name,ingredients
zhivago cocktail,"bourbon whiskey, lime juice, sour apple liqueur, sugar syrup, vanilia vodka"
zingy ginger cocktail,"chilled water, citroen vodka, ginger sugar syrup, lemon juice"
zombie,"difford's falernum liqueur, grapefruit juice, grenadine syrup, lime juice, overproof aged rum, overproof pot still rum, pernod anise, pineapple juice, rum"
zombie,"difford's falernum liqueur, grapefruit juice, grenadine syrup, lime juice, overproof aged rum, overproof pot still rum, pernod anise, pineapple juice, rum"
zombie,"difford's falernum liqueur, grapefruit juice, grenadine syrup, lime juice, overproof aged rum, overproof pot still rum, pernod anise, pineapple juice, rum"
zoom,"cognac, honey syrup, single cream / half-and-half"
zubway,"bison grass vodka, raspberries, sugar syrup, watermelon"
a1 cocktail,"dry gin, grenadine syrup, lemon juice, orange liqueur"
addington,"martini extra dry vermouth, soda water, sweet vermouth"
addison,"dry gin, sweet vermouth"
adios amigos #2,"cognac, difford's saline solution, dry gin, lemon juice, light rum, sugar syrup, sweet vermouth"
alabazam,"cognac, lemon juice, orange bitters, orange liqueur, soda water, sugar syrup"
alaska no.2,"dry gin, lemon juice, noir de bourgogne cassis, sugar syrup"
alice mine,"angostura aromatic bitters, dry gin, martini extra dry vermouth, orange liqueur, sweet vermouth"
apricot rickey,"apricot brandy liqueur, dry gin, lime juice, soda water"
arnold palmer (non-alcoholic),"black tea, lemon juice, sugar syrup"
bacardi special,"chilled water, dry gin, grenadine syrup, light rum, lime juice, sugar syrup"
bee's knees,"dry gin, honey syrup, lemon juice, orange juice"
boxcar,"dry gin, grenadine syrup, lime juice, pasteurised egg white, sugar syrup, triple sec"
brandy cocktail,"angostura aromatic bitters, cognac, mint leaves, orange liqueur, sugar syrup"
bulldog highball,"dry gin, ginger ale, orange juice"
adam & eve #2,"cognac, dry gin, lemon juice, noir de bourgogne cassis"
cham cham,"brut champagne, framboise de ronce"
citrus rum cooler,"lemon-lime soda, light rum, orange juice, orange liqueur"
crustas (generic name),"angostura aromatic bitters, brandy, whisky, gin, rum etc., lemon juice, sugar syrup"
daiquiri no.1 natural (embury's 8:2:1 formula),"bob's vanilla bitters, lime juice, rum, sugar syrup"
daiquiri no.2,"light rum, lime juice, orange juice, sugar syrup, triple sec"
el presidente (with rhum agricole),"chilled water, grenadine syrup, martini bianco vermouth, martinique blanc rhum agricole, orange curacao liqueur, rum"
embassy cocktail,"angostura aromatic bitters, cognac, light rum, lime juice, triple sec"
fair & warmer cocktail,"chilled water, light rum, orange curacao liqueur, sweet vermouth"
fairbanks no.1,"apricot brandy liqueur, chilled water, dry gin, grenadine syrup, lemon juice, martini extra dry vermouth"
fancy brandy,"angostura aromatic bitters, chilled water, cognac, sugar syrup, triple sec"
dry martini (1:1 ratio) fifty-fifty,"dry gin, martini extra dry vermouth"
fireman's sour,"grenadine syrup, light rum, lime juice, pasteurised egg white"
fix (generic name),"brandy, whisky, gin, rum etc., fruit juice, lemon juice, sugar syrup"
the flo ziegfeld,"dry gin, pineapple juice, sugar syrup"
fort lauderdale,"lime juice, orange juice, rum, sugar syrup, sweet vermouth"
frank sullivan cocktail,"cognac, lemon juice, martini extra dry vermouth, triple sec"
french sherbert,"dry gin, lime juice, orange juice, triple sec"
difford's fruit cup no.1 (gin based & pimm's cup-like),"angostura aromatic bitters, cola, dry gin, ginger ale, orange curacao liqueur, sweet vermouth"
froth blower cocktail,"dry gin, grenadine syrup, pasteurised egg white"
gin & french,"dry gin, martini extra dry vermouth"
gin & juice,"dry gin, grapefruit juice, orange juice"
gin cocktail,"boker's bitters, old simon genever, orange curacao liqueur, sugar syrup"
gin punch #1,"angostura aromatic bitters, chilled water, dry gin, lemon juice, sugar syrup"
golden bronx,"dry gin, egg yolk, martini extra dry vermouth, orange bitters, orange juice, sweet vermouth"
gloria,"brut champagne, lemon juice, sugar syrup, tequila"
grand passion,"angostura aromatic bitters, apple juice, light rum, passion fruit, pasteurised egg white, sugar syrup"
harpoon cocktail,"cranberry juice, lime juice, vodka"
highball (generic name),"brandy, whisky, gin, rum etc., ginger ale, soda, tonic water or other carbonated mixer"
honolulu cocktail no.1,"dry gin, lemon juice, orange juice, pineapple juice, sugar syrup"
hot toddy (hot cognac & lemon),"boiling water, cognac, lemon juice, sugar syrup"
houla houla cocktail,"dry gin, orange curacao liqueur, orange juice"
huapala,"chilled water, dry gin, grenadine syrup, lemon juice, light rum"
iced tea martini,"dry gin, earl grey tea, martini extra dry vermouth, sugar syrup"
larchmont,"chilled water, light rum, lime juice, orange liqueur, sugar syrup"
london cosmopolitan,"cranberry juice, dry gin, lime juice, triple sec"
mahukona,"angostura aromatic bitters, lemon juice, light rum, pineapple juice, sugar syrup, triple sec"
mint & honey daiquiri,"chilled water, honey, light rum, lime juice, mint leaves"
nevins cocktail,"angostura aromatic bitters, apricot brandy liqueur, bourbon whiskey, grapefruit juice, lemon juice"
oceanbreeze,"cranberry juice, grapefruit juice, pineapple juice, vodka"
picador,"lime juice, tequila, triple sec"
president vincent,"light rum, lime juice, martini extra dry vermouth, sugar syrup"
el presidente menocal special,"lime juice, mint leaves, rum, sugar syrup"
punch (generic name),"angostura aromatic bitters, brandy, whisky, gin, rum etc., freshly squeezed lemon or lime juice, fruit juice or water, sugar syrup"
raspberry lynchburg,"daddy rack tennessee whiskey, framboise de ronce, lemon-lime soda, lime juice, sugar syrup"
saratoga cocktail,"angostura aromatic bitters, cognac, straight rye whiskey, sweet vermouth"
shark's tooth no.1 (trader vic's),"grenadine syrup, lemon juice, lime juice, soda water, sugar syrup, white overproof rum"
silver bronx,"dry gin, martini extra dry vermouth, orange bitters, orange juice, pasteurised egg white, sweet vermouth"
sir walter cocktail,"cognac, grenadine syrup, lemon juice, orange curacao liqueur, rum"
southside,"dry gin, lime juice, mint leaves, sugar syrup"
strawberry blonde,"lemon juice, small ripe strawberries, soda water, sugar syrup, vodka"
the surfer,"cognac, lemonade"
tabu,"lemon juice, light rum, pineapple juice, sugar syrup, vodka"
tahitian honey bee,"honey syrup, lemon juice, light rum"
tnt (tequila 'n' tonic),"lime juice, tequila, tonic water"
tom arnold,"black tea, lemon juice, sugar syrup, vodka"
toreador,"agave syrup, apricot brandy liqueur, lime juice, tequila"
victorian lemonade,"chilled water, dry gin, lemon juice, mint leaves, sugar syrup"
vodka rickey,"lime juice, soda water, sugar syrup, vodka"
absinthe drop,"absinthe, anisette liqueur, chilled water"
alberto martini,"dry gin, fino sherry, martini extra dry vermouth, triple sec"
amalia,"gooseberry & mint cordial, lemon juice, light rum, sauvignon blanc wine, sugar syrup"
amante picante,"agave syrup, coriander / cilantro leaves, cucumber, green hot pepper sauce, lime juice, tequila"
amarita,"bittersweet orange-red aperitivo, bob's grapefruit bitters, lime juice, tequila"
amber room #2,"dry gin, martini extra dry vermouth, orange bitters, st-germain elderflower liqueur"
amber room,"chilled water, dry gin, green chartreuse liqueur, orange bitters, sweet vermouth"
american breakfast,"bourbon whiskey, grapefruit juice, maple syrup"
ampersand cocktail,"cognac, orange bitters, orange curacao liqueur, portobello old tom gin, sweet vermouth"
the ancient daiquiri,"drambuie liqueur, green chartreuse liqueur, light rum, lime juice, vanilla sugar syrup"
anejo highball,"angostura aromatic bitters, ginger beer, lime juice, orange curacao liqueur, rum"
anejo manhattan,"angostura aromatic bitters, orange bitters, patron anejo tequila, sweet vermouth"
angel juice,"apple juice, lime juice, pasteurised egg white, pear flavoured vodka, sauvignon blanc wine, st-germain elderflower liqueur, sugar syrup"
apple blossom,"avallen calvados, dry gin, orange juice, sugar syrup"
"apple, cucumber & elderflower cup","apple juice, bison grass vodka, cucumber, st-germain elderflower liqueur"
the apple one,"apple juice, bourbon whiskey, lime juice, soda water, st-germain elderflower liqueur"
arbuz,"apple juice, bison grass vodka, lemongrass stem, triple sec, watermelon"
argentina cocktail,"angostura aromatic bitters, benedictine d.o.m., dry gin, martini extra dry vermouth, orange bitters, triple sec"
argha noah,"cranberry juice, drambuie liqueur, honey sugar syrup, oloroso sherry, rum"
army martini,"dry gin, grenadine syrup, sweet vermouth"
astor,"dry gin, lemon juice, orange juice, swedish punsch liqueur"
astoria,"martini extra dry vermouth, orange bitters, portobello old tom gin"
autumn leaves,"angostura aromatic bitters, antica formula or other well aged sweet vermouth, avallen calvados, liquore strega, straight rye whiskey"
aviator #2,"dry gin, dubonnet red, martini extra dry vermouth, sweet vermouth"
aztec,"benedictine d.o.m., bourbon whiskey, dutch cacao white creme de cacao, hot pepper sauce"
b & t,"benedictine d.o.m., tequila"
babo natale,"creme de framboise, mint leaves, tawny port"
baccio punch,"anisette liqueur, brut champagne, dry gin, grapefruit juice, soda water"
balabushka,"apple juice, lemon juice, orgeat syrup, triple sec, vodka"
balm cocktail,"manzanilla sherry, orange bitters, orange juice, pimento dram liqueur, triple sec"
bamboo (savoy's 1930 recipe),"fino sherry, martini extra dry vermouth, sweet vermouth"
banana flambe,"banana, cachaca, cinnamon powder, cognac, lemon juice, orange juice, sugar syrup, vodka, white caster sugar"
bandera,"black pepper, grenadine syrup, hot pepper sauce, lime juice, lime juice, orange juice, patron silver blanco tequila, pomegranate juice, salt, tomato juice, worcestershire sauce"
barney barnato cocktail,"angostura aromatic bitters, cognac, kina aromatised wine, lillet blanc, orange curacao liqueur"
bartender's mum,"butterscotch liqueur, irish cream liqueur"
barton special cocktail,"avallen calvados, dry gin, whisky"
basil crush,"apple juice, basil leaves, cynar or other carciofo amaro, dry gin, green tea, honey sugar syrup, lime juice"
bat bite,"cranberry juice, creme de framboise, light rum, lime juice"
batida de abacaxi,"cachaca, condensed milk, pineapple juice, sugar syrup"
batida de banana,"banana, cachaca, condensed milk"
batida de carneval,"cachaca, condensed milk, mango puree, orange juice"
batida de goiaba,"cachaca, condensed milk, guava juice"
batida de milho verde,"cachaca, condensed milk, sweetcorn"
batida de morango,"cachaca, condensed milk, fraise des bois, small ripe strawberries"
batida rosa,"cachaca, grenadine syrup, lemon juice, pineapple juice, soda water"
beachcomber's daiquiri,"light rum, lime juice, sugar syrup, triple sec"
rum barrel (by donn beach),"absinthe, angostura aromatic bitters, difford's falernum liqueur, grapefruit juice, grenadine syrup, honey sugar syrup, light rum, lime juice, orange juice, overproof pot still rum, pimento dram liqueur, pineapple juice"
bearskin martini,"martini extra dry vermouth, mentzendorff kummel liqueur, vodka"
the beauty beneath,"angostura aromatic bitters, italian red bitter liqueur, rum, sweet vermouth, triple sec"
bermondsey breeze,"cucumber, lime juice, mint leaves, pinot grigio white wine, st-germain elderflower liqueur, sugar syrup"
berry smash (non-alcoholic),"apple juice, blackberries, cranberry juice, honey sugar syrup, lemon juice, raspberries"
beverly hills hotel cocktail,"dry gin, grapefruit juice, st-germain elderflower liqueur"
bicardar,"apricot brandy liqueur, chilled water, lemon juice, light rum, luxardo maraschino liqueur, orange bitters"
big juicy (non-alcoholic),"cranberry juice, grenadine syrup, lime juice, pineapple juice, soda water, sugar syrup"
biggles aviation,"creme de violette liqueur, dry gin, ginger liqueur, lemon juice, sugar syrup"
biggles sidecar,"cognac, ginger liqueur, lemon juice, peychaud's or other creole-style bitters, sugar syrup"
bison sour,"bison grass vodka, cinnamon powder, lemon juice, pasteurised egg white, sugar syrup"
bitches brew,"demerara / dark muscovado sugar syrup, egg, lime juice, martinique blanc rhum agricole, pimento dram liqueur, rum"
bitter grapefruit,"bittersweet orange-red aperitivo, grapefruit juice, sweet vermouth, vodka"
bitter lady,"dry gin, honey, italian red bitter liqueur, lemon juice, pasteurised egg white"
black eye,"blackberries, drambuie liqueur, irish whiskey, mint leaves, noir de bourgogne cassis, raspberries"
black rose,"angostura aromatic bitters, bourbon whiskey, cognac, grenadine syrup, peychaud's or other creole-style bitters"
black strap,"benedictine d.o.m., brown creme de cacao, dark/black/blackstrap rum, hot pepper sauce"
bloodhound #1,"dry gin, luxardo maraschino liqueur, martini extra dry vermouth, raspberries, sweet vermouth"
blood sage,"blood orange juice, dry gin, lime juice, pasteurised egg white, sage leaves, sugar syrup"
bloody bronx cocktail,"blood orange juice, dry gin, martini extra dry vermouth, sweet vermouth"
bloody mary (difford's recipe),"amontillado sherry, black pepper, celery salt, hot pepper sauce, lemon juice, sugar syrup, tomato juice, vodka, worcestershire sauce, yellow bell pepper"
blue eyed martini,"blue curacao, dry gin, martini extra dry vermouth, vodka"
blue hawaii,"blue curacao, lemon juice, light rum, lime juice, pineapple juice, sugar syrup, vodka"
blue mountain cocktail,"blue curacao, coffee liqueur, orange juice, rum, vodka"
blue sky,"blue curacao, dry gin, lime juice, luxardo maraschino liqueur"
bluegrass,"angostura aromatic bitters, bittersweet orange-red aperitivo, bourbon whiskey, cucumber, orange bitters, sugar syrup"
bobby burns cocktail (crockett's recipe),"absinthe, orange bitters, sweet vermouth, whisky"
bobby de niro,"apricot brandy liqueur, apricot jam, dry gin, lemon juice, orange bitters"
bohemian mule,"absinthe, ginger beer, lime juice, sugar syrup"
bonsoni,"chilled water, fernet liqueur, sweet vermouth"
bouquet,"chilled water, dry gin, honey, lemon juice, rose sugar syrup"
bourbon renewal,"angostura aromatic bitters, bourbon whiskey, lemon juice, noir de bourgogne cassis, sugar syrup"
brandy daisy,"cognac, lemon juice, soda from siphon, sugar syrup, yellow chartreuse liqueur"
breakfast club,"honey, lapsang souchong tea, light rum, orange marmalade"
broken spur,"anisette liqueur, dry gin, dry white port, egg yolk, sweet vermouth"
bronze adonis,"ambre/amber vermouth, fino sherry, manzanilla sherry, orange bitters"
bullfrog #2,"lemon-lime soda, lime juice, vodka"
butterfly cocktail,"basil leaves, green grapes, lemon juice, mint leaves, st-germain elderflower liqueur, vodka"
byculla,"fino sherry, ginger liqueur, orange liqueur, tawny port"
the c&c,"cognac, triple sec"
caipi,"italian red bitter liqueur, lime, sugar syrup"
caipiruva bacchanalia,"bob's grapefruit bitters, cachaca, honey sugar syrup, lime, red grapes, sauternes dessert wine"
campirinha,"italian red bitter liqueur, lime, ruby red grapefruit, sugar syrup"
capitano,"antica formula or other well aged sweet vermouth, italian red bitter liqueur, lemon juice, sugar syrup"
casino,"lemon juice, luxardo maraschino liqueur, orange bitters, portobello old tom gin"
casse noissette,"coffee liqueur, hazelnut liqueur, single cream / half-and-half, vodka"
champagne pick-me-up,"brut champagne, cognac, grenadine syrup, orange juice"
champino,"brut champagne, italian red bitter liqueur, sweet vermouth"
chartreuse swizzle,"difford's falernum liqueur, green chartreuse liqueur, lime juice, pineapple juice"
cherry mariner,"cherry heering cherry brandy liqueur, chilled water, dry gin, luxardo maraschino liqueur, orange bitters, sweet vermouth"
chrysanthemum,"absinthe, benedictine d.o.m., martini extra dry vermouth"
chubacabras daiquiri,"absinthe, light rum, lime juice, luxardo maraschino liqueur, orange flower/blossom water, orgeat syrup"
churchill martini,dry gin
cider house rules,"agave syrup, apple juice, cinnamon powder, lemon juice, tequila"
clairvoyant,"fino sherry, hazelnut liqueur, martini extra dry vermouth, orange bitters"
clara astie cocktail,"apricot jam, bob's grapefruit bitters, chilled water, light rum, luxardo maraschino liqueur, martini extra dry vermouth"
clover club (lowe's recipe),"dry gin, lemon juice, martini extra dry vermouth, pasteurised egg white, raspberry sugar syrup"
clover club (difford's recipe),"dry gin, lemon juice, martini extra dry vermouth, pasteurised egg white, raspberries, sugar syrup, sweet vermouth"
cloysters,"bob's grapefruit bitters, chilled water, dry gin, grapefruit juice, lemon juice, sugar syrup, yellow chartreuse liqueur"
clubland cocktail,"angostura aromatic bitters, dry white port, vodka"
el coco,"coconut water, light rum, lime juice, sugar syrup"
coffee cocktail,"cognac, egg, sugar syrup, tawny port"
cold blooded,"cranberry juice, lemon juice, orange liqueur, rosemary sprig, sugar syrup"
colony,"dry gin, grapefruit juice, luxardo maraschino liqueur, sugar syrup"
cooperstown,"dry gin, martini extra dry vermouth, mint leaves, sweet vermouth"
corpse reviver no.1 (gilberg's recipe),"absinthe, avallen calvados, cognac, sweet vermouth"
corpse reviver no.2 (contemporary recipe),"absinthe, chilled water, dry gin, lemon juice, lillet blanc, yellow chartreuse liqueur"
cornwall negroni,"dry gin, italian red bitter liqueur, orange bitters, punt e mes or other full-bodied vermouth, sweet vermouth"
cosmogroni,"cranberry juice, dry gin, italian red bitter liqueur, sweet vermouth"
crapple (non-alcoholic),"apple juice, cranberry juice, lime juice, sugar syrup"
cream soda cocktail,"lemon-lime soda, licor 43 original liqueur, light rum, vanilia vodka"
crushed strawberry fizz,"lemon juice, portobello old tom gin, small ripe strawberries, soda from siphon, sugar syrup"
cuban heal,"cynar or other carciofo amaro, honey sugar syrup, light rum, pallini limoncello liqueur, peychaud's or other creole-style bitters"
cubata,"cola, dry gin, lime juice"
cunningham,"benedictine d.o.m., blood orange juice, cherry heering cherry brandy liqueur, lemon juice, whisky"
daiquiri authentico,"galliano l'autentico liqueur, light rum, lime juice, sugar syrup"
daiquiri (on-the-rocks),"difford's daiquiri bitters, lime juice, rum, sugar syrup"
daiquiri (frozen),"lime juice, luxardo maraschino liqueur, rum, sugar syrup"
daiquiri no.3,"grapefruit juice, lime juice, luxardo maraschino liqueur, rum, sugar syrup"
daiquiri no.4 (florida style),"chilled water, lime, luxardo maraschino liqueur, rum, sugar syrup"
daiquiri no.5 (pink daiquiri),"chilled water, grenadine syrup, light rum, lime juice, luxardo maraschino liqueur, sugar syrup"
daiquiri noir,"drambuie liqueur, lime juice, mint leaves, rum, sugar syrup"
damn it jimmy,"fino sherry, light rum, martini extra dry vermouth, sake, sugar syrup"
darlington,"avallen calvados, blue curacao, dry gin, lemon juice, martini extra dry vermouth, sugar syrup"
death in the gulf stream,"angostura aromatic bitters, lime, lime juice, old simon genever, sugar syrup"
the democrat,"bourbon whiskey, creme de peche de vigne liqueur, honey syrup, lemon juice"
devil's cocktail,"lemon juice, martini extra dry vermouth, tawny port"
devil's share,"bourbon whiskey, lemon juice, maple syrup, orange juice, root ginger"
dimi-tini,"cherry heering cherry brandy liqueur, lime juice, raspberries, sugar syrup, vodka"
filthy dirty martini,"dry gin, lime juice, martini extra dry vermouth, olive brine"
dixie cosmopolitan,"cinnamon stick, cranberry juice, lime cordial, liqueur, triple sec"
doheny pisco punch,"angostura aromatic bitters, barsol mosto verde italia pisco, ginger beer, lemon juice, mint leaves, pineapple juice, vanilla sugar syrup"
la dolce vita,"green grapes, honey, orange bitters, prosecco sparkling wine, vodka"
don daisy,"lemon juice, light rum, martini extra dry vermouth, pasteurised egg white, st-germain elderflower liqueur, sugar syrup"
don's delight,"bourbon whiskey, disaronno amaretto, lime juice, pasteurised egg white, patron anejo tequila, sugar syrup"
don's passion,"galliano l'autentico liqueur, grenadine syrup, light rum, lime juice, orange juice, passion fruit"
dreiklang (three of a kind),"agave syrup, tequila, xocolatl mole bitters"
dry daiquiri,"italian red bitter liqueur, lime juice, passion fruit syrup, rum, sugar syrup"
the dubonnet cocktail #1,"dry gin, dubonnet red, lemon juice"
the dubonnet cocktail #2,"dry gin, dubonnet red, lemon juice"
dutch martini,"martini extra dry vermouth, old simon genever, orange curacao liqueur, vodka"
dutch master,"fino sherry, st-germain elderflower liqueur, tonic water, vodka"
east meets west julep,"bourbon whiskey, grenadine syrup, honey sugar syrup, mint leaves, pomegranate juice"
east village athletic club,"lemon juice, orange liqueur, patron silver blanco tequila, yellow chartreuse liqueur"
eastern raspberry sidecar,"cognac, lemon juice, raspberries, sake, sugar syrup, triple sec"
eastern sin,"angostura aromatic bitters, cherry heering cherry brandy liqueur, pineapple juice, sweet vermouth, triple sec, whisky"
1862,"angostura aromatic bitters, fino sherry, lemon juice, light rum, luxardo maraschino liqueur, pasteurised egg white, sugar syrup"
eighteen '97,"bepi tosolini grappa di moscato, kumquats, merlot red wine, st-germain elderflower liqueur, sugar syrup"
elixir 66,"absinthe, apple juice, apple schnapps liqueur, chilled water, coriander / cilantro leaves, green chartreuse liqueur, lime juice, sugar syrup"
elixirita,"agave syrup, cognac, lime, tequila"
especie,"angostura aromatic bitters, chilled water, difford's falernum liqueur, light rum"
eureka cocktail,"avallen calvados, cherry heering cherry brandy liqueur, lemon juice, sloe gin"
facundo's flare,"bittersweet orange-red aperitivo, light rum, orange juice, pasteurised egg white, peach bitters, vanilla sugar syrup"
falconi,"martini extra dry vermouth, orange bitters, straight rye whiskey, tawny port"
fallen angel,"angostura aromatic bitters, difford's saline solution, dry gin, lemon juice, peppermint pastille creme de menthe, sugar syrup"
fig supreme,"figs, grenadine syrup, lime juice, orange liqueur, patron anejo tequila"
final ward,"green chartreuse liqueur, lemon juice, luxardo maraschino liqueur, straight rye whiskey"
fifth degree,"italian red bitter liqueur, luxardo maraschino liqueur, sweet vermouth, vodka"
fitzgerald,"angostura aromatic bitters, dry gin, lemon juice, sugar syrup"
fizz a la violette,"creme de violette liqueur, lemon juice, pasteurised egg white, portobello old tom gin, single cream / half-and-half, soda from siphon, sugar syrup"
flame of love martini,"fino sherry, orange peel, vodka"
flipping good,"difford's falernum liqueur, egg yolk, rum"
flip williams,"angostura aromatic bitters, bourbon whiskey, egg yolk, poire william liqueur, single cream / half-and-half, sugar syrup"
the formosa,"dry white port, sake"
four leaf clover,"apple juice, clove, honey sugar syrup, light rum, lime juice"
french connection,"cognac, disaronno amaretto"
pastis whisky sour,"angostura aromatic bitters, lemon juice, pasteurised egg white, ricard pastis, sugar syrup, whisky"
frisco sour,"angostura aromatic bitters, benedictine d.o.m., bourbon whiskey, lemon juice, lime juice, orange bitters, pasteurised egg white, sugar syrup"
full monte,"angostura aromatic bitters, brut champagne, dry gin, lemon juice, light rum, luxardo maraschino liqueur, patron silver blanco tequila, sugar syrup, vodka"
fumigator flip,"cherry heering cherry brandy liqueur, egg yolk, sugar syrup, whisky, whisky"
gin daisy #2 (jerry thomas style),"lemon juice, old simon genever, orange liqueur, soda from siphon, sugar syrup"
gin daisy #3 (modern long style),"dry gin, grenadine syrup, lemon juice, soda water"
gin gin,"dry gin, ginger wine"
gin punch #2,"chilled water, lemon juice, luxardo maraschino liqueur, old simon genever, orange juice, pineapple juice, raspberries, sugar syrup"
ginger beer daiquiri,"angostura aromatic bitters, ginger beer, lime juice, sugar syrup"
ginger snap,"angostura aromatic bitters, dry gin, ginger ale, ginger liqueur, lemon juice, triple sec"
golden reign,"galliano l'autentico liqueur, orange liqueur, rum, single cream / half-and-half, sugar syrup"
good hope plantation rum punch,"lime juice, orange curacao liqueur, overproof pot still rum, soda water, triple sec"
goody-goody,"dry gin, dubonnet red, lemon juice, yellow chartreuse liqueur"
grand designs,"dry gin, martini extra dry vermouth, pineapple juice, rosemary sprig, st-germain elderflower liqueur"
grand slam,"martini extra dry vermouth, swedish punsch liqueur, sweet vermouth"
grape cocktail,"green chartreuse liqueur, green grapes, vodka"
grapefruit daiquiri #2 (non-alcoholic),"angostura aromatic bitters, grapefruit juice, lime juice, sugar syrup"
green beetle,"absinthe, agave syrup, pallini limoncello liqueur, tequila"
green melon sour,"green melon liqueur, lemon juice, lime juice"
guardabosques,"green melon liqueur, tequila"
guard's cocktail,"dry gin, orange bitters, orange liqueur, sweet vermouth"
habanero,"drambuie liqueur, honey sugar syrup, light rum, lime juice, orange bitters, pasteurised egg white, red jalapeno/fresno chili deseeded & chopped, root ginger"
hand grenade,"dry gin, green melon liqueur, light rum, pineapple juice, vodka"
he's at home,"bob's peppermint bitters, green chartreuse liqueur, lime juice"
hesitation,"bourbon whiskey, chilled water, lemon juice, swedish punsch liqueur"
hibiscus kiss,"brut champagne, hibiscus flower in syrup, pear flavoured vodka, st-germain elderflower liqueur"
hibiscus margarita,"hibiscus sugar syrup, lime juice, tequila"
highland drum,"angostura aromatic bitters, drambuie liqueur, honey sugar syrup, martini extra dry vermouth, orange juice, speyside single malt scotch whisky"
hobson,"absinthe, sloe gin, triple sec"
