name,ingredients
the artist's muse,"barsol mosto verde italia pisco, creme de peche de vigne liqueur, lemon juice, pasteurised egg white, sugar syrup, suze gentian liqueur"
bitter jean,"angostura aromatic bitters, antica formula or other well aged sweet vermouth, noir de bourgogne cassis, speyside single malt scotch whisky, whisky"
the ribbon,"blood orange liqueur, fino sherry, italian red bitter liqueur, vermouth di torino"
the last time (aka stop fiddling with my drink),"benedictine d.o.m., bob's vanilla bitters, coconut rum liqueur, fino sherry, rum"
she's like,"celery bitters, skinos mastiha, suze gentian liqueur"
quintessential drop,"absinthe, cynar or other carciofo amaro, italian red bitter liqueur, whisky"
via roma,"cynar or other carciofo amaro, ferro china baliva, italian red bitter liqueur, sweet vermouth"
pass the dutchie,"bob's coriander bitters, old simon genever, orange curacao liqueur, tawny port"
dramble,"creme de mure liqueur, lemon juice, sugar syrup, whisky"
for sake's sake,"italicus liqueur, light rum, orange curacao liqueur, sake"
old hickory (britten's recipe),"antica formula or other well aged sweet vermouth, martini extra dry vermouth, orange bitters, peychaud's or other creole-style bitters"
blueberry caipirinha,"blueberries, cachaca, lime, white caster sugar"
strawberry & basil caipirinha,"basil leaves, cachaca, lime, powdered sugar, small ripe strawberries"
pineapple & mint caipirinha,"cachaca, lime, mint leaves, pineapple, white caster sugar"
ginger & fig caipirinha,"cachaca, figs, ginger liqueur, lime, white caster sugar"
cucumber jalapeno caipirinha,"cachaca, cucumber, jalapeno slice, lime, white caster sugar"
red grape caipirinha,"cachaca, lime, red grapes, white caster sugar"
sweet grape caipirinha (caipirinha d'uva),"cachaca, lime, red grapes, sauternes dessert wine, white caster sugar"
bamboo cocktail (stuart's 1904 recipe),"fino sherry, orange bitters, sweet vermouth"
bamboo cocktail (joaquin simo's recipe),"angostura aromatic bitters, fino sherry, martini extra dry vermouth, orange bitters, sugar syrup"
bamboo cocktail (with palo cortado sherry),"martini extra dry vermouth, orange bitters, palo cortado sherry"
banana caipirinha,"banana, banana liqueur, cachaca, lime, white caster sugar"
kiwi caipirinha,"cachaca, kiwi fruit, lime, white caster sugar"
tessmanian devil,"cayenne pepper, dry gin, hot pepper sauce, lemon juice, lillet blanc, liquore strega, peychaud's or other creole-style bitters"
rosemary tuck,"orange bitters, orange juice, sugar syrup, tawny port, whisky"
naughty german,"jagermeister, lemon juice, noir de bourgogne cassis, sugar syrup"
jager old-fashioned,"bob's chocolate bitters, bourbon whiskey, jagermeister, maple syrup"
purple stag,"berry fruit tea, blackcurrant jam, jagermeister, lemon juice, maple syrup"
black forest sour,"cherry heering cherry brandy liqueur, jagermeister, lemon juice, pasteurised egg white, pineapple juice, sugar syrup"
bamboo cocktail (boothby's 1908 recipe),"angostura aromatic bitters, fino sherry, martini extra dry vermouth, orange bitters"
tropical lady,"*special ingredient #1, angostura aromatic bitters, bacardi 8 year old rum, lime juice, luxardo maraschino liqueur, sugar syrup"
the viento,"agave syrup, bacardi 8 year old rum, coconut oil, lemon juice, light rum, strawberry puree"
curiosity,"bacardi 8 year old rum, earl grey tea, pedro ximenez sherry, suze gentian liqueur, vanilla sugar syrup"
the ocho watchman,"angostura aromatic bitters, bacardi 8 year old rum, bob's grapefruit bitters, cynar or other carciofo amaro, martini bianco vermouth"
out to sea,"bacardi 8 year old rum, cold brew coffee, difford's falernum liqueur, difford's saline solution, fernet liqueur"
simple punch,"*special ingredient #1, cucumber, lemon peel, light rum, martini extra dry vermouth"
clarita,"absinthe, amontillado sherry, bacardi 8 year old rum, difford's saline solution, dutch cacao white creme de cacao"
el obsequio (the gift),"americano bianco, light rum, lime juice, mimosa syrup"
the rum pickle,"bacardi gold rum, chardonnay white wine, white balsamic vinegar, white caster sugar"
let's go bananas,"banana, light rum, lime juice, martini extra dry vermouth, ricard pastis, sugar syrup"
chapeau,"*special ingredient #1, bacardi 8 year old rum, balsamic vinegar of modena, blackcurrant / cassis sugar syrup, salt"
look for the silver lining,"honey syrup, light rum, lime juice, orange curacao liqueur, vanilla ice-cream"
sin limites,"green cardamom pods, italian red bitter liqueur, light rum, lime juice, vanilla sugar syrup"
the moment,"lemon juice, light rum, pomegranate juice, prosecco sparkling wine, ramazzotti amaro, sugar syrup"
electric avenue,"bacardi gold rum, lime juice, pineapple juice, ruby port, sugar syrup"
madame lily,"absinthe, apple, avallen calvados, light rum, lime juice, sugar syrup"
elixir tropical,"angostura aromatic bitters, light rum, lime juice, luxardo maraschino liqueur, mint leaves, orgeat syrup"
mariel,"absinthe, bacardi 8 year old rum, coconut water, honey, orange juice"
union,"light rum, lime juice, liquore strega, maple syrup, pineapple juice"
big fish,"*special ingredient #1, bacardi 8 year old rum, fino sherry, sherry vinegar"
admiral's salute,"americano bianco, angostura aromatic bitters, bacardi 8 year old rum, fino sherry, grenadine syrup, peach bitters"
cuban pete,"coconut water, dutch cacao white creme de cacao, light rum, lime juice, mint leaves"
rain or shine,"bob's grapefruit bitters, carrot juice, green mint syrup, guava juice, light rum, lime juice"
celebration (by grzegorz nowicki),"*special ingredient #1, angostura aromatic bitters, bacardi gold rum, prosecco sparkling wine"
flight 1862,"*special ingredient #1, egg white, light rum, lime juice, sugar syrup"
solaris,"*special ingredient #1, honey syrup, light rum, lime juice, peychaud's or other creole-style bitters, pineapple juice"
marshall,"agave syrup, bacardi 8 year old rum, black pepper, lemon juice, oloroso sherry, st-germain elderflower liqueur"
el luchador,"*special ingredient #1, angostura aromatic bitters, fernet liqueur, light rum, lime juice, soda water"
gonzo,"amontillado sherry, bacardi 8 year old rum, bob's grapefruit bitters, luxardo maraschino liqueur, tonic water"
memento,"*special ingredient #1, banana, light rum, lime juice, peychaud's or other creole-style bitters, yellow chartreuse liqueur"
apostol,"bacardi 8 year old rum, brown creme de cacao, cinnamon powder, pedro ximenez sherry, straight rye whiskey"
la blanca,"*special ingredient #1, egg white, extra virgin olive oil, light rum, lime juice"
efe,"*special ingredient #1, *special ingredient #2, bacardi 8 year old rum, hazelnut oil, sweet vermouth"
pilar,"light rum, lime juice, mint leaves, peach aperitif liqueur, pineapple sugar syrup, soda water"
something tasty,"apricot brandy liqueur, light rum, lime juice, pineapple juice, yuzu juice"
it was all a dream,"*special ingredient #1, averna amaro, bacardi 8 year old rum, orange juice, pimento dram liqueur"
playa fortuna,"*special ingredient #1, *special ingredient #2, difford's falernum liqueur, light rum, lime juice"
showgirl cocktail,"bittersweet orange-red aperitivo, brut champagne, framboise de ronce, martini riserva speciale ambrato, rose petal liqueur, vodka"
blushing mimosa,"brut champagne, grenadine syrup, orange juice, pineapple juice"
blackberry agave caipirinha,"agave syrup, blackberries, cachaca, lime"
the joanna,"bob's lavender bitters, fino sherry, martini extra dry vermouth, st-germain elderflower liqueur, vodka"
dutch sour,"bob's grapefruit bitters, lemon juice, orange bitters, orange curacao liqueur, pasteurised egg white, sugar syrup, vodka"
embrasse de la terre,"celery bitters, martini extra dry vermouth, old simon genever, yellow chartreuse liqueur"
pomegranate daiquiri,"light rum, lime juice, pomegranate juice, sugar syrup"
scandinavian daiquiri,"akvavit / aquavit, lime juice, sugar syrup"
courtside,"apple juice, lime juice, raspberries, small ripe strawberries, soda water, st-germain elderflower liqueur, sugar syrup, vodka"
sherry herbst,"bourbon whiskey, difford's falernum liqueur, oloroso sherry, punt e mes or other full-bodied vermouth, straight rye whiskey"
french kiwi & apple caipirinha,"apple juice, cachaca, kiwi fruit, lime, pernod anise, white caster sugar"
watermelon caipirinha,"cachaca, lime, powdered sugar, watermelon"
melon caipirinha,"cachaca, lime, melon, white caster sugar"
melon & apple caipirinha,"apple juice, cachaca, lime, melon, white caster sugar"
pineapple caipirinha,"cachaca, lime, pineapple, white caster sugar"
scotch whisky fruit cup (difford's cup no.2),"angostura aromatic bitters, cola, ginger ale, orange curacao liqueur, sweet vermouth, whisky"
brandy fruit cup (difford's cup no.3),"angostura aromatic bitters, cognac, cola, ginger ale, orange curacao liqueur, sweet vermouth"
rum fruit cup (difford's cup no.4),"angostura aromatic bitters, cola, ginger ale, orange curacao liqueur, rum, sweet vermouth"
rye whiskey fruit cup (difford's cup no.5),"angostura aromatic bitters, cola, ginger ale, orange curacao liqueur, straight rye whiskey, sweet vermouth"
vodka fruit cup (difford's cup no.6),"angostura aromatic bitters, cola, ginger ale, orange curacao liqueur, sweet vermouth, vodka"
tequila fruit cup (difford's cup no.7),"bob's lavender bitters, cola, ginger ale, orange curacao liqueur, sweet vermouth, tequila"
mezcal fruit cup (diffords no.8 cup),"bob's lavender bitters, cola, del maguey vida mezcal, ginger ale, orange curacao liqueur, sweet vermouth"
pisco fruit cup (difford's cup no.9),"amargo chuncho bitters, barsol mosto verde italia pisco, cola, ginger ale, orange curacao liqueur, sweet vermouth"
cachaca fruit cup (difford's cup no.10),"angostura aromatic bitters, cachaca, cola, ginger ale, orange curacao liqueur, sweet vermouth"
old tom gin fruit cup (difford's cup no.11),"angostura aromatic bitters, cola, ginger ale, orange curacao liqueur, portobello old tom gin, sweet vermouth"
calvados fruit cup (difford's cup no.13),"angostura aromatic bitters, avallen calvados, cola, ginger ale, orange curacao liqueur, sweet vermouth"
genever fruit cup (difford's cup no.12),"angostura aromatic bitters, cola, ginger ale, old simon genever, orange curacao liqueur, sweet vermouth"
aged rum fruit cup (difford's cup no.14),"angostura aromatic bitters, cola, ginger ale, orange curacao liqueur, rum, sweet vermouth"
bourbon fruit cup (difford's cup no.15),"angostura aromatic bitters, bourbon whiskey, cola, ginger ale, orange curacao liqueur, sweet vermouth"
tennessee whiskey fruit cup (difford's cup no.17),"angostura aromatic bitters, cola, daddy rack tennessee whiskey, ginger ale, orange curacao liqueur, sweet vermouth"
pineapple martini (1990s recipe),"lime juice, pineapple juice, sugar syrup, vodka"
pineapple martini (difford's recipe),"lime juice, pineapple juice, pineapple liqueur, sugar syrup, tiki bitters, vodka"
pineapple daiquiri (difford's recipe),"difford's daiquiri bitters, lime juice, pineapple juice, pineapple liqueur, pineapple rum, rum, sugar syrup"
gin & it (rosolio recipe),"dry gin, italicus liqueur"
ipalicus,"india pale ale beer, italicus liqueur"
negroni bianco bergamotto,"dry gin, italicus liqueur, martini extra dry vermouth"
caribbean colada,"coconut sugar syrup, light rum, orange juice, passion fruit syrup, pineapple liqueur, rum"
tropical pineapple daiquiri,"difford's daiquiri bitters, light rum, lime juice, orgeat syrup, pineapple liqueur"
stiletto manhattan,"daddy rack tennessee whiskey, disaronno amaretto, martini extra dry vermouth, orange bitters"
rhubarb negroni,"dry gin, italian red bitter liqueur, rabarbaro liqueur, sweet vermouth"
paisley spritz,"chardonnay white wine, drambuie liqueur, ginger ale"
la sang jaune (the yellow blood),"absinthe, avallen calvados, martini extra dry vermouth, st-germain elderflower liqueur, suze gentian liqueur"
czechmate,"becherovka liqueur, budweiser budvar, lemon juice, sugar syrup, vodka"
shadow boxer,"cachaca, eau-de-vie d'abricot, italian red bitter liqueur, martini extra dry vermouth, pamplemousse liqueur"
gallicus,"italicus liqueur, prosecco sparkling wine"
montreal cocktail (official city cocktail),"bittersweet orange-red aperitivo, canadian rye whisky, dry gin, suze gentian liqueur"
soixante-quinze (washington herald 1915 recipe),"applejack brandy bottled-in-bond, chilled water, dry gin, grenadine syrup, lemon juice"
french 75 (judge jr's 1927 recipe),"brut champagne, dry gin, lemon juice, powdered sugar"
french 95 (a french '75' with bourbon),"bourbon whiskey, brut champagne, lemon juice, powdered sugar"
coffee coolatta,"bourbon whiskey, coffee liqueur, cold brew coffee, lemon juice, pineapple juice"
schnitzelburg,"bourbon whiskey, cardamaro amaro, fernet liqueur, luxardo maraschino liqueur"
the waysider,"bourbon whiskey, ginger beer, lime juice, mint leaves, sugar syrup"
limoncello spritz,"pallini limoncello liqueur, prosecco sparkling wine, soda water"
plb,"angostura aromatic bitters, lemon, pallini limoncello liqueur, tonic water"
lemon sherbet margarita,"agave syrup, lemon juice, lemon sorbet, pallini limoncello liqueur, patron silver blanco tequila"
brazuca remedy,"basil leaves, bittersweet orange-red aperitivo, cachaca, honey syrup, lemon juice, pallini limoncello liqueur, pasteurised egg white"
renaissance,"cognac, pallini limoncello liqueur, peach bitters, sweet vermouth"
spiked arnold palmer,"black tea, lemon juice, pallini limoncello liqueur"
black basil,"basil leaves, lemon juice, pallini limoncello liqueur, sugar syrup, tonic water, vodka"
nobile cocktail,"bitter lemon, italian red bitter liqueur, orange juice, pallini limoncello liqueur, raspberries, vodka"
yo ho,"bitter lemon, light rum, pallini limoncello liqueur"
red earl,"pallini limoncello liqueur, raspberries, sugar syrup, vodka"
dmc,"citroen vodka, lemon juice, pallini limoncello liqueur, vanilla sugar syrup"
french 125 (french '75' with cognac) jones' 1977 recipe,"brut champagne, cognac, lemon juice, powdered sugar"
french 75 (difford's recipe),"absinthe, avallen calvados, brut champagne, cognac, grenadine syrup, lemon juice, portobello old tom gin, powdered sugar"
biblical quartet,"apple juice, avallen calvados, ice cider, medium dry apple cider"
flat white martini,"espresso coffee, irish cream liqueur, vodka"
alternatini,"dutch cacao white creme de cacao, martini extra dry vermouth, sweet vermouth, vodka"
old friend,"dry gin, grapefruit juice, italian red bitter liqueur, st-germain elderflower liqueur"
pineapple sour,"bourbon whiskey, lemon juice, pasteurised egg white, pineapple liqueur, vanille de madagascar"
pineapple daiquiri (simple but tasty recipe),"light rum, lime juice, pineapple juice, rum, sugar syrup"
archibald's last memory cocktail,"benedictine d.o.m., fernet liqueur, luxardo maraschino liqueur, straight rye whiskey"
fin de siecle (end of century) cocktail,"amer picon, dry gin, orange bitters, sweet vermouth"
beginning of the end,"amer picon, antica formula or other well aged sweet vermouth, oloroso sherry, rum"
mirror match,"avallen calvados, demerara / dark muscovado sugar syrup, irish whiskey, jagermeister, jerry thomas bitters, orange bitters, parfait amour liqueur"
merry widow fizz,"lemon juice, orange juice, pasteurised egg white, powdered sugar, sloe gin, soda water"
sex on the beach,"cranberry juice, framboise de ronce, orange juice, peachtree peach schnapps, pineapple juice, vodka"
sloe gin cocktail,"martini extra dry vermouth, orange bitters, sloe gin"
slow comfortable screw against a cold hard wall,"galliano l'autentico liqueur, liqueur, orange juice, sloe gin, vodka, white overproof rum"
slow comfortable screw against a cold hard wall with a kiss,"disaronno amaretto, galliano l'autentico liqueur, liqueur, orange juice, sloe gin, vodka, white overproof rum"
slow comfortable screw against the wall with a bang,"galliano l'autentico liqueur, liqueur, orange juice, sloe gin, vodka, white overproof rum"
slow comfortable mexican screw against the wall,"galliano l'autentico liqueur, liqueur, orange juice, patron silver blanco tequila, sloe gin, vodka"
slow comfortable screw between the sheets,"cognac, light rum, liqueur, orange juice, sloe gin, vodka"
slow comfortable fuzzy screw against the wall,"galliano l'autentico liqueur, liqueur, orange juice, peachtree peach schnapps, sloe gin, vodka"
alabama slammer (long),"disaronno amaretto, lemon juice, liqueur, orange juice, sloe gin, vodka"
alabama slammer (shot),"disaronno amaretto, lemon juice, liqueur, orange juice, sloe gin"
hairy navel,"orange juice, peachtree peach schnapps, vodka"
gin tonica,"dry gin, tonic water"
red earl (salvatore's recipe),"pallini limoncello liqueur, raspberries, root ginger, sugar syrup, vodka"
koko colada,"coconut rum liqueur, pineapple juice, rum"
vodka soda,"soda water, vodka"
contrasting faces,"*special ingredient #1, bob's grapefruit bitters, cognac, martini rosato"
intimacy,"*special ingredient #1, angostura aromatic bitters, bob's chocolate bitters, bourbon whiskey, cognac, peychaud's or other creole-style bitters, sugar syrup"
mon ami,"*special ingredient #1, cognac, creme de peche de vigne liqueur"
the compass rose,"amontillado sherry, cognac, lemon juice, mandarin soda, st-germain elderflower liqueur"
the bon vivant,"cognac, mandarin soda, martini extra dry vermouth, martini riserva speciale bitter"
battement,"cognac, jasmine sugar syrup, lime juice, plum bitters"
coeur de pirate,"*special ingredient #1, cognac"
green as grass,"absinthe, apple schnapps liqueur, celery bitters, cognac, lemon juice"
psycho killer cocktail,"*special ingredient #1, absinthe, banana liqueur, dutch cacao white creme de cacao, irish whiskey"
rum & raisin espresso martini,"coffee liqueur, espresso coffee, pedro ximenez sherry, rum"
choc mint alexander,"bob's chocolate bitters, brown creme de cacao, cognac, dutch cacao white creme de cacao, pasteurised egg white, peppermint pastille creme de menthe, single cream / half-and-half"
eclipse cocktail (by leo robitschek),"bittersweet orange-red aperitivo, cherry heering cherry brandy liqueur, del maguey vida mezcal, lemon juice, patron anejo tequila"
rite of spring,"americano bianco, portobello old tom gin, rhubarb bitters, suze gentian liqueur"
negrino,"fino sherry, sloe gin, suze gentian liqueur"
pirate queen,"cinnamon sugar syrup, ginger sugar syrup, honey syrup, lemon juice, old simon genever, peychaud's or other creole-style bitters, rum, small ripe strawberries, sugar syrup"
fade to black cocktail,"blackberries, charcoal powder, lemon juice, pasteurised egg white, spiced rum, sugar syrup"
port old-fashioned,"bob's abbotts bitters, bourbon whiskey, maple syrup, tawny port"
le premier word cocktail,"dry gin, green chartreuse liqueur, lemon juice, medium dry apple cider"
dr. rieux,"avallen calvados, demerara / dark muscovado sugar syrup, lemon juice, light rum, orange curacao liqueur, swedish punsch liqueur"
mexican squeeze,"lemonade, lime juice, patron silver blanco tequila"
apicius,"creme de chataigne, dry gin, fernet liqueur, italian red bitter liqueur, orange curacao liqueur"
macca margarita,"lime juice, orange juice, sugar syrup, tequila, triple sec"
raisin' cane,"amontillado sherry, martinique v.s.o.p rum, pineau des charentes rouge, xocolatl mole bitters"
sour grapes,"angostura aromatic bitters, bourbon whiskey, lemon juice, pasteurised egg white, pineau des charentes blanc, sugar syrup"
'two guns' miller,"cinnamon sugar syrup, pamplemousse liqueur, sweet vermouth, tequila, xocolatl mole bitters"
the road not taken,"boston bittahs bitters, peach aperitif liqueur, spiced gin, suze gentian liqueur"
pterodactyl cocktail,"absinthe, dry gin, suze gentian liqueur, vermouth di torino"
suzerac,"absinthe, peychaud's or other creole-style bitters, straight rye whiskey, sugar syrup, suze gentian liqueur"
loose talk,"benedictine d.o.m., lemon juice, lime juice, luxardo maraschino liqueur, straight rye whiskey, suze gentian liqueur, yellow chartreuse liqueur"
the italian job cocktail,"americano bianco, bittersweet orange-red aperitivo, byrrh grand quinquina, orange bitters, overproof pot still rum"
surfer on acid cocktail,"coconut rum liqueur, jagermeister, pineapple juice"
flor de don juan,"basil leaves, lime juice, st-germain elderflower liqueur, sugar syrup, tequila"
marigold spritz,"creme de peche de vigne liqueur, patron silver blanco tequila, tonic water"
old acquaintance,"dry gin, grapefruit juice, italian red bitter liqueur, lime juice, sugar syrup"
peat's dragon,"black pepper, lillet blanc, martini extra dry vermouth, orange liqueur, speyside single malt scotch whisky, whisky"
rollergirl,"blue curacao, fino sherry, lemon juice, pineapple juice, sugar syrup, suze gentian liqueur"
ritorno alle radici (back to the roots),"bob's chocolate bitters, pedro ximenez sherry, suze gentian liqueur, vanilla pod, whisky"
the dandy (by iain meldrum),"difford's saline solution, martini extra dry vermouth, speyside single malt scotch whisky, suze gentian liqueur"
suze-ann sour,"dry gin, lemon juice, pasteurised egg white, sugar syrup, suze gentian liqueur, triple sec"
sunny disposition highball,"apricot brandy liqueur, bitter lemon, lemon juice, suze gentian liqueur, tequila"
haystack cocktail,"apricot brandy liqueur, bourbon whiskey, lemon juice, suze gentian liqueur"
swiss watch,"kirschwasser eau-de-vie, lemon juice, suze gentian liqueur, yellow chartreuse liqueur"
french spritz,"brut champagne, soda water, st-germain elderflower liqueur, suze gentian liqueur"
swiss account,"benedictine d.o.m., bob's grapefruit bitters, suze gentian liqueur, vodka"
oleo sacrament,"benedictine d.o.m., daddy rack tennessee whiskey, lime oleo saccharum, peychaud's or other creole-style bitters, plum bitters"
nearest & dearest,"daddy rack tennessee whiskey, jade perique la veritable liqueur de tabac, ramazzotti amaro, toasted pecan bitters"
cool smoke,"*special ingredient #1, *special ingredient #2, daddy rack tennessee whiskey, martini riserva speciale ambrato, pasteurised egg white, peychaud's or other creole-style bitters"
apple-jacked,"*special ingredient #1, *special ingredient #2, *special ingredient #3, *special ingredient #4, daddy rack tennessee whiskey, lemon oleo saccharum"
meet me at the lynchburg highway,"*special ingredient #1, absinthe, cynar or other carciofo amaro, daddy rack tennessee whiskey, peychaud's or other creole-style bitters"
mai suit & tai,"*special ingredient #1, *special ingredient #2, daddy rack tennessee whiskey, italicus liqueur, lime juice"
for peggy,"*special ingredient #1, daddy rack tennessee whiskey, green grapes, sweet vermouth"
leave a message after the beep...,"*special ingredient #1, *special ingredient #2, daddy rack tennessee whiskey, lemon juice, martini riserva speciale rubino, pasteurised egg white"
coming of age,"*special ingredient #1, banana liqueur, coconut sugar syrup, daddy rack tennessee whiskey, italian red bitter liqueur"
sbagliato with tonic,"italian red bitter liqueur, sweet vermouth, tonic water"
it's hartnell damn it!,"rum, sauvignon blanc wine, swedish punsch liqueur"
cucumber spritz,"cucumber tonic water, elderflower cordial, sauvignon blanc wine"
washington's applejack mule,"angostura aromatic bitters, applejack brandy bottled-in-bond, ginger beer, lime juice"
marguerite no.2 (modern),"fino sherry, grapefruit juice, luxardo maraschino liqueur, soda water, tequila"
don's coco punch,"coconut sugar syrup, lime juice, pineapple puree, tequila, yellow chartreuse liqueur"
susto,"byrrh grand quinquina, celery bitters, del maguey vida mezcal, montenegro amaro"
black manhattan,"angostura aromatic bitters, averna amaro, orange bitters, straight rye whiskey"
g+t royale,"brut champagne, dry gin, orange bitters, tonic water, vanilla sugar syrup"
ginger snap (fino sherry & ginger ale),"fino sherry, ginger ale"
keyser suze,"martini bianco vermouth, martini extra dry vermouth, orange bitters, suze gentian liqueur"
time for suze,"*special ingredient #1, absinthe, old simon genever, sugar syrup, suze gentian liqueur"
clandestine,"honey syrup, italicus liqueur, suze gentian liqueur, whisky"
gen'tonique,"byrrh grand quinquina, suze gentian liqueur, tonic water"
glass & bottle,"americano bianco, dry gin, lemon juice, salt, sugar syrup, suze gentian liqueur"
the alchemist,"del maguey vida mezcal, lime juice, luxardo maraschino liqueur, orgeat syrup, suze gentian liqueur"
swiss cup 5,"ginger ale, grapefruit juice, straight rye whiskey, suze gentian liqueur, sweet vermouth, tonic water"
word by word,"lemon juice, mint leaves, suze gentian liqueur, tequila, yellow chartreuse liqueur"
youth & treachery,"martini extra dry vermouth, patron silver blanco tequila, suze gentian liqueur"
le very french 75,"brut champagne, dry gin, lemon juice, lillet rouge, suze gentian liqueur"
triangle,"poire william eau-de-vie, suze gentian liqueur, triple sec"
smoky mizu,"lillet blanc, suze gentian liqueur, whisky"
paycheck,"absinthe, dry gin, honey syrup, martini extra dry vermouth, suze gentian liqueur, triple sec"
suzette au bal (suzette at the ball),"del maguey vida mezcal, lemon juice, pasteurised egg white, poire william liqueur, sugar syrup, suze gentian liqueur"
canadian tuxedo,"canadian rye whisky, lemon juice, montenegro amaro, suze gentian liqueur"
the healer,"amaro nonino quintessentia, bourbon whiskey, lemon juice, licor 43 original liqueur, suze gentian liqueur"
day la vie,"bourbon whiskey, lemon juice, montenegro amaro, straight rye whiskey, suze gentian liqueur"
tezonita,"martini bianco vermouth, martini extra dry vermouth, patron silver blanco tequila, suze gentian liqueur"
jersey's best dancers,"del maguey vida mezcal, martini extra dry vermouth, suze gentian liqueur"
fernand x nando,"angostura aromatic bitters, avallen calvados, cachaca, suze gentian liqueur"
and now for something suze,"bigallet thym, dry gin, martini extra dry vermouth, suze gentian liqueur"
