name,ingredients
abacaxi ricaco,"lime juice, pineapple, rum, white caster sugar"
abbey,"angostura aromatic bitters, dry gin, lillet blanc, orange juice"
a.b.c. cocktail,"cognac, luxardo maraschino liqueur, mint leaves, sugar syrup, tawny port"
absinthe cocktail,"absinthe, chilled water, sugar syrup"
absinthe frappe,"absinthe, anisette liqueur, chilled water, sugar syrup"
absinthe sour,"absinthe, lemon juice, pasteurised egg white, peychaud's or other creole-style bitters, sugar syrup"
absinthe suisesse,"absinthe, milk, orgeat syrup, pasteurised egg white, single cream / half-and-half"
absinthe without leave,"absinthe, green banana liqueur, irish cream liqueur"
absolutely fabulous,"brut champagne, cranberry juice, vodka"
acapulco,"grapefruit juice, pineapple juice, rum, sugar syrup, tequila"
acapulco daiquiri,"lemon juice, light rum, lime cordial, pasteurised egg white, triple sec"
ace,"dry gin, grenadine syrup, pasteurised egg white, single cream / half-and-half"
ace of clubs daiquiri,"dutch cacao white creme de cacao, lime juice, rum, sugar syrup"
achilles heel,"apple juice, bison grass vodka, framboise de ronce, lemon juice, peachtree peach schnapps"
adam & eve,"angostura aromatic bitters, bourbon whiskey, galliano l'autentico liqueur, sugar syrup"
adios,"coffee liqueur, tequila"
adonis,"oloroso sherry, orange bitters, sweet vermouth"
affinity,"angostura aromatic bitters, martini extra dry vermouth, vermouth amaro, whisky"
after eight,"dutch cacao white creme de cacao, peppermint pastille creme de menthe, vodka"
after six shot,"coffee liqueur, creme de menthe, irish cream liqueur"
afterburner,"coffee liqueur, creme de menthe, white overproof rum"
aged honey daiquiri,"chilled water, honey syrup, lime juice, rum"
aggravation,"coffee liqueur, milk, single cream / half-and-half, sugar syrup, whisky"
air mail,"brut champagne, honey syrup, lime juice, rum"
a.j.,"avallen calvados, grapefruit juice, sugar syrup"
alabama slammer (straight-up),"grenadine syrup, liqueur, orange juice, vodka"
alabama slammer,"disaronno amaretto, lemon juice, liqueur, orange juice, sloe gin"
alamagoozlum cocktail,"angostura aromatic bitters, chilled water, jamaican aged blended rum, old simon genever, orange curacao liqueur, pasteurised egg white, sugar syrup, yellow chartreuse liqueur"
alan's apple breeze,"apple juice, apricot brandy liqueur, cranberry juice, light rum, lime juice, sugar syrup"
alaska (savoy recipe),"chilled water, dry gin, yellow chartreuse liqueur"
alessandro,"black sambuca liqueur, dry gin, milk, single cream / half-and-half"
alexander,"dry gin, dutch cacao white creme de cacao, pasteurised egg white, single cream / half-and-half"
alexander the great,"coffee liqueur, dutch cacao white creme de cacao, single cream / half-and-half, vodka"
alexander's big brother,"blue curacao, dry gin, pasteurised egg white, single cream / half-and-half, sugar syrup, triple sec"
alexander's sister,"dry gin, pasteurised egg white, peppermint pastille creme de menthe, single cream / half-and-half, sugar syrup"
alexandra,"coffee liqueur, navy rum, pasteurised egg white, single cream / half-and-half"
alfonso,"angostura aromatic bitters, brut champagne, dubonnet red, white caster sugar"
algonquin,"martini bianco vermouth, peychaud's or other creole-style bitters, pineapple juice, straight rye whiskey"
alice from dallas,"coffee liqueur, orange liqueur, tequila"
alice in wonderland,"orange liqueur, tequila"
all fall down,"coffee liqueur, navy rum, tequila"
all white frappe,"creme de menthe, dutch cacao white creme de cacao, lemon juice, luxardo sambuca"
almond cocktail,"apple juice, lemon juice, orgeat syrup, peach bitters, vodka"
almond martini,"bob's vanilla bitters, chilled water, disaronno amaretto, martini extra dry vermouth, vodka"
almond old fashioned (tequila based),"agave syrup, disaronno amaretto, orange bitters, tequila"
amaretto sour,"angostura aromatic bitters, disaronno amaretto, lemon juice, pasteurised egg white"
amber,"apple juice, apple schnapps liqueur, bison grass vodka, root ginger, sugar syrup"
ambrosia,"avallen calvados, brut champagne, cognac, lemon juice, triple sec"
ambrosia cocktail,"cognac, licor 43 original liqueur, warninks advocaat liqueur, yellow chartreuse liqueur"
american beauty (by david embury),"cognac, creme de menthe, grenadine syrup, martini extra dry vermouth, orange juice, shiraz red wine"
american pie cocktail,"apple juice, apple schnapps liqueur, bourbon whiskey, cranberry juice, creme de myrtille liqueur, lime juice"
americana,"angostura aromatic bitters, bourbon whiskey, brut champagne, white caster sugar"
americano,"italian red bitter liqueur, soda water, sweet vermouth"
anis'tini,"black sambuca liqueur, chilled water, pernod anise, star anise, vodka"
anita's attitude adjuster,"brut champagne, dry gin, light rum, lime juice, sugar syrup, tequila, triple sec, vodka"
apache,"coffee liqueur, green melon liqueur, irish cream liqueur"
aphrodisiac,"apple juice, green chartreuse liqueur, root ginger, sauvignon blanc wine, vanilia vodka"
apple & blackberry pie,"apple juice, blackberries, single cream / half-and-half, vodka"
apple & cranberry pie,"apple schnapps liqueur, cranberry juice, single cream / half-and-half, vodka"
apple & custard cocktail,"apple schnapps liqueur, avallen calvados, vanilla sugar syrup, warninks advocaat liqueur"
apple & elderflower collins,"apple schnapps liqueur, dry gin, lime juice, soda water, st-germain elderflower liqueur"
apple & melon cocktail,"green melon liqueur, lime juice, sour apple liqueur, vodka"
apple & spice,"avallen calvados, single cream / half-and-half"
apple brandy sour,"angostura aromatic bitters, avallen calvados, lemon juice, pasteurised egg white, sugar syrup"
apple breeze,"apple juice, bison grass vodka, cranberry juice"
apple buck,"apple juice, avallen calvados, ginger ale, lime juice, sour apple liqueur"
apple cart,"apple schnapps liqueur, avallen calvados, chilled water, lemon juice, triple sec"
apple crumble cocktail #1,"apple juice, butterscotch liqueur, lemon juice, sugar syrup, whisky"
apple crumble cocktail #2,"apple juice, lemon juice, tuaca liqueur"
apple daiquiri,"apple juice, light rum, lime juice, sugar syrup"
apple mac,"apple juice, ginger wine, whisky"
apple manhattan,"apple schnapps liqueur, bourbon whiskey, sweet vermouth"
apple martini (simple),"apple juice, sugar syrup, vodka"
apple martini (iba spec),"apple schnapps liqueur, triple sec, vodka"
apple mojito,"apple schnapps liqueur, light rum, lime juice, mint leaves"
apple of one's eye,"apple juice, cognac, ginger beer, lime juice"
apple pie cocktail,"apple juice, bison grass vodka, cinnamon schnapps & goldwasser liqueurs, cranberry juice"
apple pie shot,"apple schnapps liqueur, hazelnut liqueur, single cream / half-and-half"
appleissimo,"apple juice, apple schnapps liqueur, cranberry juice, pernod anise"
apple spritz,"apple schnapps liqueur, brut champagne, peachtree peach schnapps"
apple strudel (by alex kammerling),"apple juice, apple schnapps liqueur, brown creme de cacao, cinnamon schnapps & goldwasser liqueurs, dutch cacao white creme de cacao, single cream / half-and-half"
apple strudel,"apple juice, apple schnapps liqueur, cinnamon sugar syrup, martini extra dry vermouth, vodka, whisky"
apple sunrise,"avallen calvados, noir de bourgogne cassis, orange juice"
temperance apple mojito (non-alcoholic),"apple juice, lemon juice, lime juice, mint leaves, soda water, sugar syrup"
applesinth,"absinthe, apple juice, apple schnapps liqueur, lime juice, sugar syrup"
apples 'n' pears,"apple juice, avallen calvados, pear & cognac liqueur, vodka"
appily married,"apple juice, grapefruit juice, honey syrup, vodka"
apricot cosmo,"apricot jam, cranberry juice, lime juice, orange bitters, sugar syrup, vodka"
apricot fizz,"apricot brandy liqueur, lime juice, orange juice, soda from siphon"
apricot lady sour,"apricot brandy liqueur, lemon juice, light rum, pasteurised egg white, sugar syrup"
apricot mango cocktail,"apricot brandy liqueur, dry gin, lemon juice, mango puree, orange bitters, sugar syrup"
apricot martini,"angostura aromatic bitters, apricot brandy liqueur, chilled water, dry gin, grenadine syrup, lemon juice"
april shower,"benedictine d.o.m., cognac, orange juice"
apricot sour,"apple juice, apricot brandy liqueur, apricot jam, bourbon whiskey, lemon juice"
aquarius,"cherry heering cherry brandy liqueur, cranberry juice, whisky"
arizona breeze,"cranberry juice, dry gin, grapefruit juice"
arnaud (parisian nights),"dry gin, martini extra dry vermouth, noir de bourgogne cassis"
artlantic,"apple juice, blue curacao, disaronno amaretto, lime juice, spiced rum"
asian ginger cocktail,"root ginger, sake, sugar syrup, vodka"
asian mary,"citroen vodka, lemon juice, root ginger, soy sauce, tomato juice, wasabi paste"
asian pear cocktail,"lemon juice, pear & cognac liqueur, pear juice, poire william eau-de-vie, sake"
assisted suicide,"cola, jagermeister, light rum"
atholl brose,"disaronno amaretto, drambuie liqueur, honey, oat milk / oatmeal water, single cream / half-and-half, whisky"
atlantic breeze,"apricot brandy liqueur, galliano l'autentico liqueur, lemon juice, light rum, pineapple juice"
atomic cocktail,"amontillado sherry, brut champagne, cognac, vodka"
atomic dog,"coconut rum liqueur, green melon liqueur, lemon juice, light rum, pineapple juice"
attitude adjuster,"coffee liqueur, cola, dry gin, lime juice, orange liqueur, triple sec"
aunt agatha,"angostura aromatic bitters, navy rum, orange juice, pineapple juice"
aunt emily,"apricot brandy liqueur, avallen calvados, dry gin, grenadine syrup, orange juice"
auntie's hot xmas punch,"apple juice, cognac, lemon juice, pedro ximenez sherry, peychaud's or other creole-style bitters"
autumn cocktail,"apple juice, bison grass vodka, passion fruit, passion fruit syrup, pasteurised egg white"
autumn punch,"bison grass vodka, brut champagne, lemon juice, passion fruit, passion fruit syrup, pear juice"
avalanche,"banana, banana liqueur, disaronno amaretto, dutch cacao white creme de cacao, milk, single cream / half-and-half"
avalanche shot,"coffee liqueur, dutch cacao white creme de cacao, liqueur"
avenue,"avallen calvados, bourbon whiskey, grenadine syrup, orange bitters, orange flower/blossom water, passion fruit, sugar syrup"
aviation cocktail (difford's recipe),"chilled water, creme de violette liqueur, dry gin, lemon juice, luxardo maraschino liqueur"
aviator #1,"dry gin, lemon juice, luxardo maraschino liqueur, noir de bourgogne cassis, pasteurised egg white"
awol,"green melon liqueur, pineapple juice, vodka, white overproof rum"
azure cocktail,"apple juice, cachaca, cinnamon schnapps & goldwasser liqueurs, lime juice, sugar syrup"
b2c2,"benedictine d.o.m., brut champagne, cognac, triple sec"
b5200,"coffee liqueur, irish cream liqueur, navy rum"
b-52 shot,"coffee liqueur, irish cream liqueur, orange liqueur"
b-53 shot,"coffee liqueur, irish cream liqueur, vodka"
b-54 shot,"coffee liqueur, disaronno amaretto, irish cream liqueur"
b-55 shot,"absinthe, coffee liqueur, irish cream liqueur"
b-52 frozen,"coffee liqueur, irish cream liqueur, orange liqueur"
b & b,"benedictine d.o.m., cognac"
b. j. shot,"irish cream liqueur, orange liqueur"
baby blue cocktail,"blue curacao, dry gin, grapefruit juice, pineapple juice"
baby guinness,"coffee liqueur, irish cream liqueur"
baby woo woo,"cranberry juice, peachtree peach schnapps, vodka"
bacardi cocktail,"grenadine syrup, light rum, lime juice, sugar syrup"
bahama mama,"coconut liqueur, coconut rum liqueur, coffee liqueur, jamaican aged blended rum, lemon juice, overproof aged rum, pineapple juice"
bahamas daiquiri,"coconut rum liqueur, coffee liqueur, lime juice, overproof pot still rum, pineapple juice"
bajan mojito,"lime juice, mint leaves, passion fruit, passoa liqueur, rum, sugar syrup"
bajan passion,"apricot brandy liqueur, lime juice, passion fruit, rum, sugar syrup, vanilla sugar syrup"
bajito,"basil leaves, light rum, lime juice, mint leaves, sugar syrup"
balalaika,"lemon juice, triple sec, vodka"
bald eagle shot,"creme de menthe, tequila"
bald eagle,"cranberry juice, grapefruit juice, lemon juice, lime juice, sugar syrup, tequila"
bali trader,"green banana liqueur, pineapple juice, vodka"
ballet russe,"lime juice, noir de bourgogne cassis, sugar syrup, vodka"
baltic spring punch,"brut champagne, lemon juice, peach, rose petal liqueur, sugar syrup"
baltimore egg nog,"cognac, dark/black/blackstrap rum, egg, milk, rainwater/verdelho med-dry madeira, single cream / half-and-half, sugar syrup"
bamboo (with triple sec),"fino sherry, martini extra dry vermouth, orange bitters, triple sec"
banana bliss,"banana liqueur, bob's abbotts bitters, cognac, oloroso sherry"
banana boomer,"apricot brandy liqueur, banana liqueur, cherry heering cherry brandy liqueur, orange juice, pineapple juice, vodka"
banana colada,"banana, banana liqueur, cream of coconut, light rum, pineapple juice"
banana daiquiri,"banana, banana liqueur, lime juice, rum"
banana so smoothie (non-alcoholic),"apple juice, banana, greek yogurt, honey"
bananas & cream,"banana liqueur, disaronno amaretto, irish cream liqueur, milk, single cream / half-and-half"
banoffee cocktail,"banana, banana liqueur, butterscotch liqueur, maple syrup, milk, single cream / half-and-half, vanilia vodka"
banshee,"banana liqueur, dutch cacao white creme de cacao, single cream / half-and-half"
barbara,"dutch cacao white creme de cacao, milk, single cream / half-and-half, vodka"
barbara west,"amontillado sherry, angostura aromatic bitters, dry gin, lemon juice, sugar syrup"
barbary coast highball,"bourbon whiskey, brown creme de cacao, dry gin, single cream / half-and-half, soda water"
barbary coast,"dry gin, dutch cacao white creme de cacao, single cream / half-and-half, whisky"
barnacle bill,"chilled water, parfait amour liqueur, pernod anise, yellow chartreuse liqueur"
barnamint,"irish cream liqueur, milk, oreo cookies, peppermint pastille creme de menthe, single cream / half-and-half, vanilla ice-cream"
barnum (was right),"angostura aromatic bitters, apricot brandy liqueur, chilled water, dry gin, lemon juice"
bartender's martini,"dry gin, dubonnet red, fino sherry, martini extra dry vermouth, orange liqueur"
bartender's root beer,"coffee liqueur, cola, galliano l'autentico liqueur, lime juice"
basil & honey daiquiri,"basil leaves, honey, light rum, lime juice"
basil beauty,"basil leaves, citroen vodka, coconut sugar syrup, lime juice, passion fruit, pineapple juice"
basil bramble sling,"basil leaves, creme de mure liqueur, dry gin, lemon juice, sugar syrup"
basil grande,"basil leaves, cranberry juice, framboise de ronce, orange liqueur, small ripe strawberries, vodka"
basil mary,"basil leaves, black pepper, celery salt, horseradish sauce, hot pepper sauce, lemon juice, pepper flavoured vodka, tawny port, tomato juice, worcestershire sauce"
basilico,"basil leaves, lemon juice, pallini limoncello liqueur, sugar syrup, vodka"
batida de coco,"cachaca, condensed milk, cream of coconut"
bay breeze,"cranberry juice, pineapple juice, vodka"
bazooka,"banana liqueur, grenadine syrup, liqueur, single cream / half-and-half"
bazooka joe,"banana liqueur, blue curacao, irish cream liqueur"
bbc,"benedictine d.o.m., cognac, single cream / half-and-half"
be-ton,"becherovka liqueur, tonic water"
beach blonde,"banana, orange juice, warninks advocaat liqueur, white overproof rum"
beach iced tea,"cranberry juice, dry gin, lemon juice, light rum, sugar syrup, tequila, triple sec, vodka"
beachcomber,"light rum, lime juice, luxardo maraschino liqueur, sugar syrup, triple sec"
beam-me-up scotty,"banana liqueur, coffee liqueur, irish cream liqueur"
bebbo cocktail,"blood orange juice, dry gin, honey, lemon juice"
bee sting,"apple juice, ginger ale, honey syrup, straight rye whiskey, tequila"
bee's knees (with rum & cream),"honey, light rum, milk, navy rum, orange juice, single cream / half-and-half"
bee's tease,"dry gin, honey syrup, lapsang souchong tea, lemon juice"
beetle jeuse,"apple juice, bison grass vodka, green chartreuse liqueur, mint leaves, passion fruit syrup"
behemoth,"bourbon whiskey, dutch cacao white creme de cacao, lemon juice, maple syrup, pasteurised egg white, peychaud's or other creole-style bitters, straight rye whiskey, sweet vermouth"
beja flor cocktail,"banana liqueur, cachaca, lemon juice, triple sec"
bella donna daiquiri,"dark/black/blackstrap rum, disaronno amaretto, lemon juice, sugar syrup"
bellini (difford's recipe),"lemon juice, peach puree, peachtree peach schnapps, prosecco sparkling wine"
bellini-tini,"peach bitters, peach puree, peachtree peach schnapps, vodka"
bellissimo,"hazelnut liqueur, italian red bitter liqueur, lemon juice, pallini limoncello liqueur"
bentley,"avallen calvados, dubonnet red, peychaud's or other creole-style bitters"
berry caipirinha,"blackberries, blueberries, cachaca, lime, raspberries, small ripe strawberries, white caster sugar"
berry nice,"blackberries, framboise de ronce, ginger beer, lemon juice, vodka"
bessie & jessie,"milk, warninks advocaat liqueur, whisky"
between the sheets,"cognac, lemon juice, light rum, sugar syrup, triple sec"
beverly hills iced tea,"brut champagne, dry gin, lime juice, sugar syrup, triple sec, vodka"
biarritz,"angostura aromatic bitters, cognac, lemon juice, orange liqueur, pasteurised egg white"
big apple martini,"apple schnapps liqueur, sour apple liqueur, vodka"
the big easy,"ginger ale, liqueur, orange juice, triple sec"
bikini martini,"blue curacao, chilled water, dry gin, lemon juice, peachtree peach schnapps"
bingo,"apricot brandy liqueur, lemon juice, orange liqueur, soda water, vodka"
bird of paradise,"disaronno amaretto, dutch cacao white creme de cacao, single cream / half-and-half, tequila"
bishop,"boiling water, clove, honey, orange juice, tawny port"
bit-o-honey,"butterscotch liqueur, irish cream liqueur"
bitter elder,"angostura aromatic bitters, apple juice, dry gin, lemon juice, st-germain elderflower liqueur"
bittersweet symphony,"apricot brandy liqueur, grapefruit juice, lime juice, triple sec, vodka"
bitterest pill,"italian red bitter liqueur, passion fruit syrup, vodka"
black & tan,"pale ale, stout beer"
black & white daiquiri,"blackberries, coconut rum liqueur, creme de mure liqueur, light rum, lime juice, sugar syrup"
blackbeard,"cola, light rum, stout beer"
black bison martini,"apple juice, apple schnapps liqueur, dry gin, martini extra dry vermouth"
black dream,"black sambuca liqueur, irish cream liqueur"
black forest gateau,"fraise des bois, framboise de ronce, noir de bourgogne cassis, single cream / half-and-half, vodka"
black irish,"coffee liqueur, irish cream liqueur, vanilla ice-cream, vodka"
black jack shot,"black sambuca liqueur, daddy rack tennessee whiskey"
black magic,"brut champagne, orange liqueur, red grapes"
black diamond,"brown creme de cacao, espresso coffee, light rum"
black mussel,"blue curacao, brut champagne, noir de bourgogne cassis"
black 'n' blue caipirovska,"blackberries, blueberries, lime juice, sugar syrup, vodka"
black nuts,"black sambuca liqueur, hazelnut liqueur"
black russian,"coffee liqueur, vodka"
black velvet,"brut champagne, stout beer"
black widow,"black sambuca liqueur, coconut rum liqueur, fraise des bois, milk, single cream / half-and-half"
blackthorn (english),"chilled water, dry gin, orange bitters, sloe gin, sweet vermouth"
blackthorn (irish),"absinthe, boker's bitters, irish whiskey, martini extra dry vermouth, sweet vermouth"
blimey,"blackberries, lime juice, noir de bourgogne cassis, sugar syrup, vodka"
bling! bling!,"brut champagne, lime juice, raspberries, sugar syrup, vodka"
blinker,"bob's grapefruit bitters, grapefruit juice, grenadine syrup, straight rye whiskey"
blood and sand (classic formula),"cherry heering cherry brandy liqueur, orange juice, sweet vermouth, whisky"
bloodhound #2,"grapefruit juice, italian red bitter liqueur, vodka"
blood orange cocktail,"blood orange juice, dry gin, italian red bitter liqueur, martini extra dry vermouth"
bloody joseph,"black pepper, celery salt, horseradish sauce, hot pepper sauce, lemon juice, tomato juice, whisky, worcestershire sauce"
bloody maria,"black pepper, celery salt, horseradish sauce, hot pepper sauce, lemon juice, tawny port, tequila, tomato juice, worcestershire sauce"
bloody maru,"black pepper, celery salt, hot pepper sauce, lemon juice, sake, worcestershire sauce"
bloody mary (modern recipe),"black pepper, celery salt, hot pepper sauce, lemon juice, tomato juice, vodka, worcestershire sauce"
bloody shame (non-alcoholic),"black pepper, celery salt, horseradish sauce, hot pepper sauce, lemon juice, tomato juice, worcestershire sauce"
blow job,"banana liqueur, coffee liqueur, orange liqueur"
blue angel,"blue curacao, cognac, lemon juice, parfait amour liqueur, single cream / half-and-half"
blue bird,"blue curacao, dry gin, lemon juice, orgeat syrup"
blue blazer,"boiling water, powdered sugar, whisky"
blue champagne,"blue curacao, brut champagne, lemon juice, triple sec, vodka"
blue cosmo,"blue curacao, cranberry juice, lime juice, vodka"
blue fin,"cranberry juice, hpnotiq tropical liqueur, vodka"
blue hawaiian,"blue curacao, cream of coconut, light rum, lime juice, pineapple juice"
blue heaven,"blue curacao, disaronno amaretto, light rum, lime cordial, pineapple juice"
blue kamikaze,"blue curacao, lime juice, vodka"
blue lady,"blue curacao, dry gin, lemon juice, pasteurised egg white"
blue lagoon,"blue curacao, lemon-lime soda, lime juice, vodka"
blue margarita,"blue curacao, lime juice, sugar syrup, tequila"
blue monday,"blue curacao, citroen vodka, martini extra dry vermouth, orange bitters, triple sec"
blue moon cocktail (1940's recipe),"creme de violette liqueur, dry gin, lemon juice, pasteurised egg white, sugar syrup"
blue passion,"blue curacao, light rum, lime juice, sugar syrup"
blue riband,"blue curacao, dry gin, triple sec"
blue star,"blue curacao, dry gin, lillet blanc, orange juice"
blue velvet margarita,"blue curacao, lime juice, tequila, triple sec"
blue wave,"blue curacao, dry gin, light rum, lime juice, pineapple juice, sugar syrup"
blueberry daiquiri,"blueberries, creme de myrtille liqueur, light rum, lime juice"
blueberry martini,"blueberries, creme de myrtille liqueur, lime juice, sugar syrup, vodka"
blueberry cocktail,"blueberries, sauvignon blanc wine, sugar syrup, vodka"
blueberry tea,"breakfast tea, disaronno amaretto, orange liqueur"
blush martini,"cranberry juice, disaronno amaretto, single cream / half-and-half, vanille de madagascar, vodka"
blushin' russian,"coffee liqueur, disaronno amaretto, single cream / half-and-half, vodka"
bobby burns cocktail (craddock's recipe),"benedictine d.o.m., sweet vermouth, whisky"
bohemian iced tea,"becherovka liqueur, earl grey tea, honey liqueur, peachtree peach schnapps, vodka"
boilermaker,"bourbon whiskey, budweiser budvar"
bolero,"avallen calvados, light rum, sweet vermouth"
bolero sour,"cognac, light rum, lime juice, orange juice, pasteurised egg white, sugar syrup"
bolshoi punch,"lime juice, noir de bourgogne cassis, sugar syrup, white overproof rum"
bombay no. 2,"absinthe, cognac, martini extra dry vermouth, orange curacao liqueur, sweet vermouth"
bomber,"ginger beer, light rum, lime juice, spiced rum"
bon bon,"butterscotch liqueur, lemon juice, pallini limoncello liqueur, vanilla sugar syrup, vodka"
boomerang,"angostura aromatic bitters, bourbon whiskey, lemon juice, luxardo maraschino liqueur, martini extra dry vermouth, sugar syrup, sweet vermouth"
bora bora brew (non-alcoholic),"ginger ale, grenadine syrup, pineapple juice"
borderline,"bourbon whiskey, lemon juice, maple syrup, punt e mes or other full-bodied vermouth"
bosom caresser,"cognac, egg yolk, grenadine syrup, orange liqueur, rainwater/verdelho med-dry madeira"
bossa nova #1,"apple juice, apricot brandy liqueur, galliano l'autentico liqueur, light rum, lime juice"
bossa nova #2,"apricot brandy liqueur, galliano l'autentico liqueur, lemon juice, light rum, pineapple juice"
boston,"apricot brandy liqueur, dry gin, grenadine syrup, lemon juice, sugar syrup"
boston flip,"bourbon whiskey, egg, rainwater/verdelho med-dry madeira, sugar syrup"
boston tea party,"cola, dry gin, lime juice, martini extra dry vermouth, navy rum, orange juice, sugar syrup, tequila, triple sec, vodka, whisky"
bourbon blush,"bourbon whiskey, creme de framboise, maple syrup, small ripe strawberries"
bourbon cookie,"bourbon whiskey, butterscotch liqueur, passion fruit syrup, single cream / half-and-half"
bourbon milk punch,"bob's vanilla bitters, bourbon whiskey, milk, vanilla sugar syrup"
bourbon smash,"angostura aromatic bitters, bourbon whiskey, cranberry juice, lime juice, mint leaves, raspberries, sugar syrup"
bourbonella,"bourbon whiskey, grenadine syrup, martini extra dry vermouth, peychaud's or other creole-style bitters, triple sec"
bradford martini,"dry gin, martini extra dry vermouth, orange bitters"
brainstorm,"benedictine d.o.m., chilled water, irish whiskey, martini extra dry vermouth"
bramble,"creme de mure liqueur, dry gin, lemon juice, sugar syrup"
bramblette,"creme de violette liqueur, dry gin, lemon juice, sugar syrup"
brandy alexander,"brown creme de cacao, cognac, dutch cacao white creme de cacao, single cream / half-and-half"
brandy blazer,"boiling water, cognac, sugar syrup"
brandy buck,"cognac, ginger ale, lemon juice, orange liqueur"
brandy crusta,"angostura aromatic bitters, cognac, lemon juice, luxardo maraschino liqueur, sugar syrup, triple sec"
brandy fix,"cognac, lemon juice, pineapple juice, sugar syrup, yellow chartreuse liqueur"
brandy fizz,"cognac, lemon juice, soda from siphon, sugar syrup"
brandy flip,"cognac, egg, sugar syrup"
brandy milk punch,"cognac, milk, vanilla sugar syrup"
brandy smash,"cognac, mint leaves, sugar syrup"
brandy sour,"angostura aromatic bitters, cognac, lemon juice, pasteurised egg white, sugar syrup"
brazen martini,"bison grass vodka, parfait amour liqueur"
