name,ingredients
old barrel,"amontillado sherry, angostura aromatic bitters, benedictine d.o.m., straight rye whiskey"
jonathan's vermouth cocktail,"luxardo maraschino liqueur, noilly prat dry vermouth, peychaud's barrel-aged cocktail bitters, saline solution 4:1, sugar syrup"
consigliere,"chinotto, cynar ricetta originale artichoke amaro liqueur, fernet branca digestive bitter liqueur, italicus liqueur, luxardo maraschino liqueur, sexton single malt irish whiskey"
texas triple step,"cointreau triple sec liqueur, disaronno amaretto, lime juice, tito's handmade vodka"
chambuca,"black sambuca liqueur, brut champagne"
christmas cracker,"baileys chocolate luxe liqueur, cinnamon whisky, grand marnier liqueur"
fall from the tree,"angostura aromatic bitters, apple juice, avallen calvados, cinnamon sugar syrup, lemon juice"
bonnet's revenge,"amontillado sherry, goslings black seal rum, orange & lemon shrub, the balvenie 14 year old caribbean cask speyside single malt whisky"
samia's almond old fashioned (blended scotch based),"angostura or other aromatic bitters, cutty sark original blended scotch whisky, demerara / dark muscovado sugar syrup, disaronno amaretto"
guilherme's poet's dream,"beefeater london dry gin, chilled water, dry vermouth, orange bitters"
downhill daring,"americano bianco, angostura aromatic bitters, benedictine d.o.m., bourbon whiskey, orange bitters, punt e mes or other full-bodied vermouth"
amaroni,"angostura di amaro, dry gin, sweet vermouth"
apple butter old fashioned,"apple butter, bourbon whiskey, lemon juice, medium dry apple cider, orange bitters"
fire & flowers,"cherry bitters, creme de violette liqueur, mezcal, rye whiskey"
caribbean manhattan,"dolin rouge vermouth de chambery, fee brothers old fashion bitters, syrup from luxardo maraschino cherries, the kraken black spiced rum"
andy's penicillin cocktail,"blended scotch whisky, egg white, honey syrup, king's ginger liqueur, lemon juice, whisky"
chris's pineapple daiquiri (difford's recipe),"absinthe verte, demerara / dark muscovado sugar syrup, lime juice, orange juice, pineapple flavoured vodka, plantation stiggins' fancy pineapple rum, rum"
bob's dutch mule,"angostura or other aromatic bitters, ginger beer, hot pepper sauce, jonge genever, lime juice, vodka"
sirone summer breeze,"carbonated/sparkling/selzer mineral water, disaronno amaretto, fabbri amarena mixybar cherry syrup, lime juice"
joshua's irresistible,"angostura aromatic bitters, benedictine d.o.m. liqueur, bourbon whiskey, lemon juice, rosso/rouge vermouth"
procarstinare,"h. theoria procrastination liqueur, light rum, lime juice, maraschino liqueur, orange bitters, passion fruit puree"
patrick's harvest cocktail,"angostura aromatic bitters, averna amaro, calvados boulard vsop pays d'auge"
patrick's the beauty beneath,"angostura or other aromatic bitters, caribbean blended rum aged 6-10 years, italian red bitter liqueur, rosso/rouge vermouth, triple sec liqueur"
improved difford's fruit cup no.1 (gin based & pimm's cup-like),"angostura or other aromatic bitters, celery bitters, cola, gin, ginger ale, orange curacao liqueur, rosso/rouge vermouth"
widow's kiss (variation),"angostura aromatic bitters, benedictine d.o.m., calvados & straight applejacks, yellow chartreuse liqueur"
ralph's calmondin daiquiri (on-the-rocks),"daiquiri bitters, sugar syrup, white/gold 1-3 year old mellow light rum"
pineapple old fashioned,"chilled water, fee brothers grapefruit bitters, le sirop de monin ananas pineapple syrup, plantation stiggins' fancy pineapple rum"
french gimlet,"gin, lime juice, orange bitters, st-germain elderflower liqueur"
mezcal martinez,"carpano antica formula vermouth, cynar ricetta originale artichoke amaro liqueur, fee brothers aztec chocolate bitters, luxardo maraschino liqueur, mezcal"
john's jungle bird,"dark/black/blackstrap rum, italian red bitter liqueur, lime juice, pineapple juice, sugar syrup"
frisky witch,"aperol aperitivo, bourbon whiskey, honey syrup, lemon juice, liquore strega, orange bitters"
joshua's the saint,"apple cider vinegar, bourbon whiskey, ginger sugar syrup, lemon juice, lillet blanc"
american trilogy,"applejack brandy bottled-in-bond, demerara / dark muscovado sugar syrup, orange bitters, straight rye whiskey"
pinga com mel,"cachaca, honey syrup, lime juice"
red light,"old simon genever, orange liqueur, underberg"
bourbon peach tea,"bourbon whiskey, brewed cold black breakfast tea, peachtree peach schnapps, triple sec"
blackberry mint margarita julep,"blackberries, honey syrup, lime juice, mint leaves, tequila"
sunset 'martini',"passion fruit puree, passion fruit vodka, small ripe strawberries, vanilla sugar syrup"
pink witch,"dry gin, grapefruit juice, liquore strega"
espresso rumtini,"coffee liqueur, difford's saline solution, espresso coffee, rum"
velvet tears,"captain morgan black spiced rum, orange bitters, pedro ximenez sherry, poire william liqueur, the bitter truth spiced chocolate bitters"
thiago 's hi life spritz,"chardonnay white wine, elderflower liqueur, gin, soda water"
sandra's gin blossom martini,"abricot eau-de-vie, bianco vermouth, gin, orange bitters"
iced rum mocha,"cold brew coffee, dark creme de cacao liqueur, kahlua coffee liqueur, milk, the kraken black spiced rum"
boca raton,"angostura or other aromatic bitters, cola, diplomatico reserva rum, lime juice, pineapple juice, sirop de orgeat syrup"
last kotoba,"bols green tea liqueur, luxardo maraschino liqueur, roku japanese gin, yellow chartreuse liqueur, yuzu juice"
final pill,"ardbeg ten, homemade ginger juice syrup, lemon juice, luxardo maraschino liqueur, orange blossom honey, yellow chartreuse liqueur"
happy together,"bols genever, le sirop de monin passion fruit sugar syrup, lime juice, mint leaves, monin grenadine syrup, soda water"
nicolas's 'martini' thyme,"gin, green chartreuse liqueur, lemon thyme, lime juice, sugar syrup"
jon 's gun metal blue cocktail,"blue curacao liqueur, chilled water, cinnamon sugar syrup, lemon juice, mezcal, peachtree peach schnapps"
dom negroni,"benedictine d.o.m., boodles british london dry gin, campari bitter liqueur, solerno delicato blood orange liqueur"
kelsey damn day's amer-etti biscotti,"amaretto liqueur, bigallet china china amer, cognac, fee brothers west indian orange bitters, whisky"
alexandre's the salty bird,"bittersweet orange-red aperitivo, lime juice, pineapple juice, salt, sugar syrup, white 1-3 year old light rum"
gin-campari sour,"'simple' sugar syrup, campari bitter liqueur, egg white, gin, lemon juice, orange bitters"
jay's smokey pinga com mel,"agave syrup, lime juice, mezcal"
i blue a quarterback,"blue curacao, milk, single cream / half-and-half, yellow chartreuse liqueur"
mary's waterlily,"chilled water, creme de violette liqueur, gin, lemon juice, triple sec liqueur"
the brooks,"cynar ricetta originale artichoke amaro liqueur, john d. taylor's velvet falernum liqueur, lime juice, smith & cross traditional pot still navy strength jamaican rum"
strawberry passion batida,"'simple' sugar syrup, alize gold passion, cachaca, lime juice, mint sprigs, small ripe strawberries"
the dirty fennel,"noilly prat extra dry vermouth, olive brine, vodka"
somewhere south of trinidad,"angostura aromatic bitters, demerara / dark muscovado sugar syrup, lime juice, plantation overproof o.f.t.d. rum"
high ryeser,"angostura aromatic bitters, straight rye whiskey, sweet vermouth"
christmas at von oosten's,"egg white, lemon juice, sugar syrup, von oosten bitter"
alexander von oosten,"dark creme de cacao liqueur, single cream / half-and-half, von oosten bitter, white creme de cacao liqueur"
espresso von oosten,"coffee liqueur, espresso coffee, sugar syrup, von oosten bitter"
oosthattan,"angostura aromatic bitters, orange bitters, rye whiskey 40-45% alc./vol., von oosten bitter"
autumn leaves,"angostura aromatic bitters, apple juice, canadian rye whisky, cointreau triple sec liqueur, lemon juice, orange blossom honey"
pillow talk,"campari bitter liqueur, cointreau triple sec liqueur, gin, laphroaig 10 year old whisky, lemon juice"
"habano banano mexicano (triple ""o"")","chili & pandan sugar syrup, lejay liqueur de banane, lime juice, mezcal, pasteurised egg white, plantation 3 stars rum"
adios motherfucker,"blue curacao, dry gin, lemon juice, lemon-lime soda, light rum, lime juice, patron silver blanco tequila, sugar syrup, vodka"
julie limey cosmo,"bombay sapphire east gin, cranberry juice, lime cordial, lime juice, triple sec liqueur"
almond old fashioned (tequila based),"agave syrup, amaretto liqueur, orange bitters, reposado tequila"
the greatest showman,"egg white, jack daniel's tennessee whiskey, lemon juice, stout beer, sugar syrup"
stambegroni,"gin, punt e mes vermouth, stambecco cherry amaro"
alex & rick's espresso,"cold brew coffee, mr black coffee liqueur"
steve's naked & famous,"campari bitter liqueur, lime juice, mezcal, yellow chartreuse liqueur"
a very good highland nail,"glayva liqueur, glenmorangie the original highland single malt scotch whisky"
sir humphrey,"dry gin, martini bianco vermouth, orange bitters"
the bren gun girl,"canadian rye whisky, italian red bitter liqueur, martini bianco vermouth"
age & guile i,"pisco, punt e mes vermouth, regans' orange bitters no.6"
mark's chicago fizz,"el dorado 3 year old white rum, lemon juice, pasteurised egg white, soda water, sugar syrup, tawny port"
margarita del diablo,"'simple' sugar syrup, ancho reyes chile liqueur, claret red wine, lime juice, reposado tequila"
robert's bradford martini,"dry vermouth, gin, orange bitters"
patrick's oaxaca old-fashioned,"bittermens xocolatl mole bitters, demerara / dark muscovado sugar syrup, jose cuervo tradicional reposado tequila, sombra agave de oaxaca mezcal"
clean aviation,"absinthe, chilled water, creme de violette liqueur, lemon juice, luxardo maraschino liqueur, vodka"
jj's screaming banana banshee,"banana, creme de banane liqueur, milk, plantation 3 stars rum, single cream / half-and-half, white creme de cacao liqueur"
tom's alaska (straub's 1914 recipe),"orange bitters, roku japanese gin, yellow chartreuse liqueur"
shawn's east 8 hold-up cocktail,"bittersweet orange-red aperitivo, lime juice, passion fruit syrup, pineapple juice, rhum clement canne bleue nv rhum agricole"
bluegrass fernando,"angostura aromatic bitters, bourbon whiskey, cola, fernet branca digestive bitter liqueur, lemon juice"
jager colada,"coconut syrup, jagermeister, lemon juice, pineapple juice, single cream / half-and-half"
timothy's tequila sunrise,"grenadine/pomegranate syrup, orange juice, reposado tequila"
blue bird - extra almond,"blue curacao, lemon juice, small hand foods orgeat, spirit works distillery gin"
anne,"cherry brandy liqueur, ciroc vodka, disaronno amaretto, gin mare mediterranean gin, orange juice"
memories of summer,"angostura aromatic bitters, blueberry syrup, lime juice, rhubarb liqueur, vodka"
donald's el presidente,"absinthe verte, dolin dry vermouth de chambery, grenadine/pomegranate syrup, peychaud's aromatic bitters, triple sec liqueur, vya sweet vermouth, zaya gran reserva 12 year old rum"
l'arte della bellezza,"americano bianco, bepi tosolini grappa di moscato, italicus liqueur"
pink mist,"amontillado sherry, italian red bitter liqueur, italicus liqueur, lemon bitters, martini bianco vermouth"
cup of justice,"chocolate bitters, hennessy vs cognac, montenegro amaro, st-germain elderflower liqueur"
kristof's scorpion,"cognac, don papa rum, lemon juice, orange juice, orgeat sugar syrup"
cherry zombie (mild version),"angostura aromatic bitters, fee brothers cherry bitters, goslings black seal rum, grapefruit juice, john d. taylor's velvet falernum liqueur, lime juice, orgeat sugar syrup"
nathalie's olympic,"cognac, grand marnier liqueur, grapefruit bitters, orange juice"
a scotch in the caribbean,"blended scotch whisky, john d. taylor's velvet falernum liqueur, salt, stones special reserve ginger wine, the bitter truth jerry thomas bitters"
papa's mai tai,"cointreau triple sec liqueur, don papa rum, lime juice, monin orgeat syrup, monin pure cane sugar syrup"
worldgarita,"pisco, skinos mastiha"
"chartreuse, tonic, and lime","green chartreuse liqueur, salt, tonic water"
winter daiquiri,"daiquiri bitters, ginger liqueur, lemon juice, monin vanilla syrup, spiced rum"
nil's margarita,"blanco tequila, cointreau triple sec liqueur, lime juice, salt, sugar syrup"
espresso fruitini,"baileys irish cream liqueur, espresso coffee, raspberri vodka"
pure peach tea,"archers peach schnapps, brewed cold black breakfast tea, lemon juice, rum, sugar syrup"
vermont sour,"egg white, lemon juice, maple syrup, ruby port, rye whiskey"
white captain,"dry gin, egg white, grand marnier liqueur, lemon juice, monin pure cane sugar syrup"
caribbean swim,"coconut rum liqueur, fee brothers cherry bitters, lemon juice, mango juice, passion fruit syrup, passoa liqueur, pineapple juice, vanilla vodka"
bitter berry,"brut champagne, creme de fraise liqueur, disaronno amaretto, galliano l'autentico liqueur, suze gentian liqueur"
kjell's wagon wheel,"cognac, grenadine/pomegranate syrup, lemon juice, liqueur, monin pure cane sugar syrup"
guardian angel,"cucumber, light rum, lime juice, montenegro amaro, orgeat sugar syrup"
irish lodge,"angostura aromatic bitters, cherry brandy liqueur, cynar ricetta originale artichoke amaro liqueur, kilbeggan irish whiskey, orange bitters, rosso/rouge vermouth"
nanzhi's godfather cocktail,"blended scotch whisky, lazzaroni amaretto liqueur, the bitter truth peach bitters"
chris's trident,"akvavit / aquavit, cynar ricetta originale artichoke amaro liqueur, fee brothers peach bitters, fino sherry, orange bitters"
stephen's haystack cocktail,"bourbon whiskey, cherry brandy liqueur, gentian liqueur, lemon juice"
old mexican friend,"del maguey vida mezcal, grapefruit juice, italian red bitter liqueur, st-germain elderflower liqueur"
flying blind with a burning engine,"chocolate bitters, edmond briottet liqueur de violette, lime juice, luxardo maraschino liqueur, monin lavender sugar syrup, quiquiriqui matatlan mezcal espadin joven"
bluzu sour,"aquafaba, blanco tequila, blue curacao liqueur, lemon juice, lime juice, margarita bitters, pasteurised egg white, salt, sugar syrup, yuzu liqueur"
el presidente,"bacardi gold rum, bianco vermouth, grenadine/pomegranate syrup, orange bitters, pierre ferrand orange curacao"
merkel no angel,"'simple' sugar syrup, campari bitter liqueur, lemon juice, passoa liqueur, pasteurised egg white, strawberry puree"
naked sherry,"gonzalez byass tio pepe palomino fino sherry, lime juice, the naked grouse scotch blended whisky"
bob's margarita on-the-rocks (difford's recipe),"agave syrup, cointreau triple sec liqueur, lime juice, margarita bitters, reposado tequila, salt"
ruby,"bittersweet orange-red aperitivo, grapefruit juice, lemon juice, pasteurised egg white, st-germain elderflower liqueur, vodka"
nacho cocktail,"blanco tequila, campari bitter liqueur, chili flakes, honey syrup, lemon juice, lime juice, orange & lemon shrub"
19th century,"bourbon whiskey, dutch cacao white creme de cacao, lemon juice, lillet rouge"
espresso martiki,"coffee liqueur, espresso coffee, orgeat syrup, pineapple juice, pineapple rum"
beverley's pear shaped #1 (deluxe version),"apple juice, blended scotch whisky, lime juice, passion fruit, pear & cognac liqueur, pear juice"
camparinha,"'simple' sugar syrup, cachaca, campari bitter liqueur, lime"
loraine's monstre verte cocktail,"absinthe verte, gin, green chartreuse liqueur, lime juice, sugar syrup"
a choice hobson,"cointreau triple sec liqueur, limoncello liqueur, sloe gin liqueur"
luca's manhattan,"angostura aromatic bitters, carpano antica formula vermouth, rye whiskey 40-45% alc./vol."
strawberry ice cream,"bepi tosolini fragola wild strawberry liqueur, milk, single cream / half-and-half, vodka"
neil's favola,"gin, italicus or other rosolio di bergamotto / bergamot liqueur, lemon juice, limoncello liqueur, sugar syrup"
maira's red caipirinha,"blueberries, cachaca, creme de cassis liqueur, lime, white caster sugar"
east wind,"dark/black/blackstrap rum, martini extra dry vermouth, sweet vermouth, vodka"
pipa,"'simple' sugar syrup, ardbeg uigeadail whisky, carpano antica formula vermouth, homemade ginger juice syrup, lemon juice"
brazilian buck,"ginger beer, lime, sugar syrup, ypioca empalhada ouro cachaca"
last upgrade,"angel's envy kentucky straight bourbon whiskey, bittersweet orange-red aperitivo, green chartreuse liqueur, lemon juice"
chile manhattan,"ancho reyes chile liqueur, angostura aromatic bitters, bourbon whiskey, dry vermouth, rosso/rouge vermouth"
dirty brooklyn,"bigallet china china amer, cocchi americano bianco, kirsch liqueur, rye whiskey"
laura's hi ladies!,"lime juice, mezcal union blanco, mint leaves, sugar syrup, vodka"
subiaco,"benedictine d.o.m., lemon juice, lime juice, maker's mark bourbon, yellow chartreuse liqueur"
alexandre's old fashioned caddy,"angostura or other aromatic bitters, blended scotch whisky, cherry brandy liqueur, sweet vermouth"
sargasso (riff recipe with brandy),"angostura aromatic bitters, aperol aperitivo, cardenal mendoza, romate don jose oloroso sherry"
mediterranean cooler,"mediterranean tonic water, strawberry flavoured vodka, tawny port"
alaskan lemonade,"'simple' sugar syrup, angostura aromatic bitters, carbonated/sparkling/selzer mineral water, cointreau triple sec liqueur, lime juice, the botanist islay dry gin, yellow chartreuse liqueur"
margarita del diablo,"claret red wine, lime juice, patron silver blanco tequila, piment d'espelette chile liqueur, sugar syrup"
yamabuki,"japanese blended whisky, martini bianco vermouth, montenegro amaro, orange bitters"
aventura,"del maguey vida mezcal, lemon juice, lime juice, orange liqueur, raspberries, st-germain elderflower liqueur, sugar syrup"
frogroni,"dry gin, italian red bitter liqueur, lemon juice, small ripe strawberries, sugar syrup, sweet vermouth"
nick's blue hawaii,"blue curacao liqueur, lemon juice, lime cordial, pineapple juice, vodka, white 1-3 year old light rum"
noname,"bourbon whiskey, lemon juice, monin grenadine syrup, passion fruit juice, pasteurised egg white"
adam's brass rail,"10+ year old blended rum, benedictine d.o.m., lemon juice, orange bitters, orgeat sugar syrup"
jimmy s ghostine's maple old fashioned,"angostura or other aromatic bitters, bourbon whiskey, maple syrup, soda water"
the colby,"cranberry juice, gin, lemon juice, orange bitters, st-germain elderflower liqueur"
isle of joy,"averna amaro, cocchi americano bianco, regans' orange bitters no.6, rittenhouse bottled-in-bond straight rye whiskey, syrup from luxardo maraschino cherries"
mezgroni,"carpano antica formula vermouth, italian red bitter liqueur, mezcal"
amarula obsession,"amarula cream liqueur, disaronno amaretto, milk"
iron clad old fashioned,"avallen calvados, benedictine d.o.m., cachaca, ferro china baliva"
jungle hunt,"cinnamon sugar syrup, difford's falernum liqueur, jagermeister, lemon juice, orange bitters, pineapple juice, pineapple rum"
ban-hattan,"angostura aromatic bitters, banana sugar syrup, chilled water, straight rye whiskey, sweet vermouth"
green isaac's special,"angostura aromatic bitters, coconut water, dry gin, lime juice"
super orange margarita,"agave syrup, blanco tequila, lime juice, mandarine napoleon liqueur, orange bitters, salt, tangerine / mandarin / clementine juice"
c3 copy of a copy of a copy,"falernum syrup, gentian liqueur, hibiscus flower petals, lemon juice, mezcal, mint leaves"
softgroni,"aperol aperitivo, campari bitter liqueur, gin, rosso/rouge vermouth"
lil ripper,"averna amaro, green olives, lemon juice, orange peel, soda water"
valentina negroni,"campari bitter liqueur, cynar ricetta originale artichoke amaro liqueur, eager pink grapefruit juice, fever-tree premium indian tonic water"
mirto negroni,"campari bitter liqueur, gin, is cogas mirto liquore di sardegna"
sam's collins,"beefeater london dry gin, mint leaves, orange juice, sugar syrup, tonic water"
mark's all in,"bourbon whiskey, dark creme de cacao liqueur, dry vermouth, italian red bitter liqueur, ocean spray classic cranberry drink, pumpkin pie spice, straight rye whiskey"
gritty from philly,"'simple' sugar syrup, basil hayden's small batch kentucky straight bourbon, cointreau triple sec liqueur, orange bitters, orange juice, rosso/rouge vermouth"
gin and thyme,"aviation american gin, creme de violette liqueur, green chartreuse liqueur, limoncello liqueur, noilly prat extra dry vermouth, thyme liqueur"
meztalicus,"creme de cacao white liqueur, grapefruit juice, italicus liqueur, mezcal"
strawberry-lillet crush,"'simple' sugar syrup, lillet blanc, mint leaves, plymouth navy strength gin, small ripe strawberries"
honeyed cherry mash sour,"jack daniel's honey liqueur, lemon juice, monin pure cane sugar syrup, xo cherry brandy liqueur"
campari division bell,"campari bitter liqueur, lime juice, maraschino liqueur, mezcal"
palabra ultima,"green chartreuse liqueur, lemon juice, maraschino liqueur, mezcal"
black walnut manhattan,"amaro nonino, angostura aromatic bitters, black walnut bitters, rosso/rouge vermouth, straight rye whiskey"
charles's jack frost #2,"cranberry juice, drambuie liqueur, grenadine/pomegranate syrup, lemon juice, tennessee whiskey"
old fashioned,"angostura aromatic bitters, orange bitters, sugar cube, woodford reserve bourbon"
jack's fall,"cardamom bitters, john d. taylor's velvet falernum liqueur, laird's blended applejack, maple syrup, rye whiskey"
mad john,"bourbon whiskey, cola, jagermeister liqueur, sweet vermouth"
passport,"italian brandy, ouzo 12, vodka"
mark's greyhound's tooth,"benedictine d.o.m., grapefruit bitters, grapefruit juice, lemon juice, lime juice, vodka"
clemo gin & tonic,"gin, lime juice, orange bitters, tonic water"
martini with lillet,"gin, lillet blanc, orange bitters"
infante royale aka tropical baby,"allspice jamaica pepper, el espolon blanco 100% agave tequila, freshly grated nutmeg, lime juice, lime zest, orange & fig bitters, orange flower/blossom water, orgeat sugar syrup, root ginger"
spectre's vesper,"bombay sapphire gin, cocchi americano bianco, pierde almas espadin mezcal"
mexican beachcomber,"cointreau triple sec liqueur, lime juice, luxardo maraschino liqueur, reposado tequila"
wild card martini,"dry vermouth, gin, lemon juice, luxardo maraschino liqueur"
rob roy en blanc,"blended scotch whisky, martini bianco vermouth, peychaud's aromatic bitters"
oskar's apple business,"apple juice, cinnamon powder, gin, honey syrup, lime juice"
orange daiquiri #2,"angostura or other aromatic bitters, lime juice, maraschino liqueur, orange juice, sugar syrup"
christmas daiquiri,"cranberry juice, difford's daiquiri bitters, difford's falernum liqueur, lime juice, rum"
mezcal martinez,"angostura cocoa bitters, antica formula or other well aged sweet vermouth, cynar or other carciofo amaro, del maguey vida mezcal, luxardo maraschino liqueur"
h.s.l. special,"absinthe, creme de mure liqueur, lime juice, montenegro amaro, sugar syrup"
honey cosmopolitan,"bob's grapefruit bitters, cranberry juice, grapefruit flavoured vodka, grapefruit juice, honey syrup, lime juice"
the frank,"del maguey vida mezcal, italian red bitter liqueur, martini extra dry vermouth, montenegro amaro, patron silver blanco tequila, sweet vermouth"
nil's orange bloom martini,"cointreau triple sec liqueur, luxardo maraschino liqueur, rosso/rouge vermouth, tanqueray no. ten gin"
strawberry daiquiri,"angostura or other aromatic bitters, demerara / dark muscovado / brown sugar, gordons distillers cut gin, sirop de fraises, small ripe strawberries"
marc's h.s.l. special,"absinthe verte, creme de cassis liqueur, lime juice, montenegro amaro, sugar syrup"
bed of roses,"grenadine syrup, jagermeister, lemon juice, lime juice"
southern irish cream,"baileys irish cream liqueur, southern comfort liqueur"
mark's old fashioned,"angostura aromatic bitters, bulleit kentucky straight bourbon whiskey, chilled water, demerara / dark muscovado / brown sugar, triple sec liqueur"
laphroaig project,"fee brothers peach bitters, green chartreuse liqueur, laphroaig quarter cask whisky, lemon juice, luxardo maraschino liqueur, yellow chartreuse liqueur"
alyssa's cassini,"cranberry juice, creme de cassis liqueur, gin, rosemary sprig, rosemary sugar syrup, vodka"
chris's the frank,"blanco tequila, luxardo aperitivo, mezcal, montenegro amaro, noilly prat extra dry vermouth, rosso/rouge vermouth"
florida man,"aperol aperitivo, del maguey vida mezcal, fernet branca digestive bitter liqueur, lime juice, sirop de orgeat syrup, st-germain elderflower liqueur"
velvet thorn,"angostura aromatic bitters, camus xo cognac, hibiscus flower in syrup, kaffir lime, kaffir lime leaf, lemon juice, pinot noir red wine"
great gatsby (leo stepien),"campari bitter liqueur, grapefruit juice, lillet blanc, sugar syrup, vodka"
green ghost,"dry gin, green chartreuse liqueur, lime juice, sugar syrup"
it's always sunny,"americano bianco, lemon juice, orange bitters, orange juice, sugar syrup, vodka"
mr. bali hai,"coffee liqueur, jamaican aged blended rum, lemon juice, light rum, pineapple juice, sugar syrup"
mezcalero,"bob's grapefruit bitters, del maguey vida mezcal, ginger sugar syrup, lemon juice, triple sec"
brazilian soda,"cachaca, cream soda, lime juice"
want to daddy?,"light rum, lime juice, monin mango syrup, monin peach syrup, passoa liqueur, pasteurised egg white"
p & g,"fino sherry, lemon juice, orange bitters, st-germain elderflower liqueur"
braulio amber negroni,"amaro braulio, bittermens burlesque bitters, gin, lemon juice, lillet blanc"
artichoke hold,"cynar or other carciofo amaro, lemon juice, orgeat syrup, overproof pot still rum, st-germain elderflower liqueur"
gin paloma,"grapefruit gin, grapefruit juice, lime juice, soda water, sugar syrup"
stranger in the alps,"amaro braulio, beefeater london dry gin, campari bitter liqueur, carpano antica formula vermouth, clear creek eau de vie of douglas fir, salt"
